,id,link_id,parent_id,created_utc,author,score,controversiality,gilded,downs,ups,body
612,czh3w9f,t3_43bqa1,t3_43bqa1,1454116870.0,Austin_Rivers,4316,0,2,0,4316,"**Before anyone continue to defend what the Fine Bros are doing, they are just using PR talk to confuse you and pretend like they are ""franchising"" their specific brand. No, they are using React World to capture ALL react videos. They are already using their lawyers to bully others who make react videos. Here are some common responses defending the Fine Bros and why they are incorrect:**

----

**The Fine Bros are just branding their specific react videos, not all reaction videos**

1.	They have already legally trademarked Kids React, Teens React, and Elders React. They have been using their lawyers to threaten other channels who are attempting to make videos of kids react videos for years.
2.	Once React World launches, react videos of any demographic that falls under their media empire are their trademark. You can currently make â€œengineers reactâ€, or â€œnurses reactâ€, but once the Fine Bros successfully trademark all of these reaction types, they can use their lawyers to threaten you just like they currently threaten you for making kids react videos.
3.	They feel so entitled to their â€œformatâ€ that they think anything remotely similar to one of their â€œformatsâ€ is infringing on their intellectual property. They even threatened ELLEN for stealing their â€œformatâ€. Ellenâ€™s video is nothing like anything the Fine Bros do, sheâ€™s just showing kids on her show some old technology: https://www.youtube.com/watch?v=3CMS9xnBRkc They made a facebook post calling Ellen thieves and bullies stealing and not respecting the Fine Bros. Theyâ€™ve deleted that post but their tweet still exists (please screen cap it before they delete this too): https://twitter.com/thefinebros/status/513061415016341504
4.	In summary, the Fine Bros have always felt entitled to their unoriginal and stolen format. They say they wonâ€™t go after other content creators but they have been using their lawyers to shut down other content creators for years. They feel so entitled that they even considered that Ellen segment an infringement on their â€œformatâ€. 

This should give you a VERY clear idea of what kind of people and what kind of motive the Fine Bros have.

**These guys are just licensing their shows to others, whatâ€™s the big deal?**

1.	That is their PR talk. Letâ€™s look at their actions. Theyâ€™ve used their leverage with Youtube to take down channels that were making kids react videos and seniors react videos. Theyâ€™ve even threatened Ellen on Facebook and tried to use their fans to brigade Ellen for daring to produce this segment: https://www.youtube.com/watch?v=3CMS9xnBRkc

**They are just talking about their specific format, brand, etc. Not a big deal**

1.	They trademark every aspect of their â€œformatâ€ which already overlaps with what other reaction videos are. 

2. Once they use their fans to expand their trademark into every type of react video under the sun, then they can use their legal leverage to push you out. 

----

**The Fine Brosâ€™ Strategy to trademark ALL react videos**

1.	Make no mistake about it, the Fine Bros fully intend on making ALL react videos theirs. And React World is how they will do it. The Fine Bros already trademarked kids react, teens react, elders react, etc. You cannot make a video of kids reacting to redbull and call it â€œkids react to Redbullâ€. Donâ€™t believe me? Here are the Fine Brosâ€™ own words: http://imgur.com/oik8CsA
2.	So how does this lead to them trademarking ALL react videos? Well once React World goes online, and people of all demographics make react videos and put them under Fine Brosâ€™ empire, they will then trademark all of those new react titles the same way they did with Kids React. In other words, you can make â€œNurses Reactâ€ right now because they havenâ€™t trademarked it, but once Nurses React becomes part of their empire through React World, they can then trademark it and stick their lawyers on you threatening you with legal action unless you take your videos down. THIS is how they intend on taking over ALL reaction videos. Itâ€™s underhanded, manipulative, and has enough steps in between for them the have hidden this in plain sight.
3.	If you still donâ€™t believe this, then try making a kids react video right now and call it â€œkids react to ___â€. YOU CANâ€™T. The Fine Bros have used their lawyers to threaten people who have done this already and theyâ€™ll do it to you. Do not believe them when they say they wonâ€™t prevent other people from making other â€œtypesâ€ of reaction videos. They will only allow you to make your videos until they trademark your videoâ€™s name. They will do that through React World because they donâ€™t need to put in any effort into actually making content anymore.

----

**What is The Fine Bros Afraid of?**

The Fine Bros' office employs over 40 people and have HUGE overheads. Beyond losing a few subscribers, what the Fine Bros are afraid of the most right now is **losing their sponsors**. They get very little money from Youtube ads compared to their sponsors. Here's them talking about their sponsors two years ago:

>The company has created branded content for Universal Studiosâ€™ â€œA Million Ways to Die in the West,â€ AMCâ€™s â€œHalt and Catch Fire,â€ Friskies cat food and Audible. â€œWe have a series that is something brands can be organically integrated into,â€ Benny said.

>The Fine Bros. are affiliated with YouTube multichannel network Fullscreen. They are repped by WME and managed by Max Benator.

http://variety.com/2014/digital/news/youtubes-fine-bros-launch-react-channel-1201266727/

They recently did a brand deal with Disney for Star Wars too.

They've taken on so many employees and have so much overhead cost that losing even a single sponsor means they are going to have to have **layoffs**. According to several former employees and a current employee working in their office (posting in previous threads), there is serious concern about potential layoffs coming because sponsors are worried about being associated with all the negativity.

So the Fine Bros have a lot on their hands. There will be lawsuits coming to challenge their ridiculous trademark on ""React"". There will be a lot of pissed off people flooding their sponsors' social media pages that may cost them sponsors. And they are dealing with serious office morale loss because of how tainted their ""brand"" is. The Fine Bros built their business on internet culture, they should have really known better than to think they could get away with this.

**The Fine Bros are potentially going to lose their new TV show ""Six Degrees of Everything"" on TruTV**

The Fine Bros currently has an ongoing TV show on TruTV that just completed its first season last year: http://www.imdb.com/title/tt4566242/

The Fine Bros wants to ""[grow into a big media company](http://variety.com/2014/digital/news/youtubes-fine-bros-launch-react-channel-1201266727/)"". This is why the Fine Bros had their entire staff monitor social media sites to scrub your comments. They deleted thousands of comments and are still heavily censoring their Facebook comments so that any hard questions or criticisms of their trademark attempt do not show up. They do not want TruTV to find out. But now that people are starting to go to TruTV (and its parent company), they apparently gave up on hardcore censorship of their Youtube comments.

**Edit: Thanks to /u/bboyjkang we've dug up The Fine Bros' deleted facebook post that called on their fans to brigade Ellen's show for doing a segment that had nothing to do with their Kids React format. Need anymore proof of their entitled attitude, their anti-competitive aggression, and their REAL motives for trademarking ""react""?**

Once something goes on the internet, it's there forever Fine Bros. You don't own the format of talking to kids, as much as you may want to: http://imgur.com/idasVMZ

**The Fine Bros attacking large channels for stealing their format**

[Ellen](https://www.reddit.com/r/videos/comments/43e6a9/link_inside_in_2014_the_fine_bros_told_its/)

[Buzzfeed](https://twitter.com/thefinebros/status/572989392672837633)

**Mounting evidence of them abusing DMCA takedowns to shut down smaller react channels**

A channel that made seniors react videos was shut down by the Fine Bros a few weeks before the Fine Bros launched ""Elders React"":

The actual archived video of seniors react: http://web.archive.org/web/20120406235634/http://www.youtube.com/watch?v=99bwWcZ2Eg8&gl=US&hl=en#

Their old twitter: https://twitter.com/seniorsreact

Read the comment section of this knowyourmemepage: http://knowyourmeme.com/videos/39959-nyan-cat-pop-tart-cat

Talks of Fine Bros taking down other reaction makers go back for YEARS. Yet, in their AMA, they still claim they aren't doing it.

https://www.reddit.com/r/starcraft/comments/rwv47/seniors_react_to_huskystarcraft/

If anyone can find the creator of this original series, please have them contact one of the lawyers offering pro bono services to sue the Fine Bros.

Fine Bros abusing DMCA to take down Ocubox:

https://www.change.org/p/why-is-youtube-allowing-false-dmca-take-downs

Ocubox just retwteeted this: https://twitter.com/TheWhang/status/692928629265821696

Ocubox was a channel that was making ""British Kids React"" videos that was abused by the Fine Bros DCMA harassment and forced to stop making ""British Kids React"" videos. The Fine Bros STILL want to lie to us and claim they aren't using their ""trademark"" to go after EVERYBODY. Doesn't matter if you are small (Ocubox, seniors react) or big (Ellen), The Fine Bros feels entitled to your stuff.

8-Bit Eric talks about him being targeted by The Fine Bros and getting his reaction videos taken down: https://www.youtube.com/watch?v=Jfc_HE8dJ5k
"
613,czh4vub,t3_43bqa1,t1_czh3w9f,1454118774.0,HyphenSam,24,0,0,0,24,[Here's an archive of the tweet in case it gets taken down.](https://web.archive.org/web/20160130015041/https:/twitter.com/thefinebros/status/513061415016341504)
614,czhi0v8,t3_43bqa1,t1_czh4vub,1454158332.0,gee_I_am_a_tree,1,0,0,0,1,"I'm trying to use the web archive to load their facebook page from around the time they made that tweet, to see if I could find the Ellen post, but the site just constantly reloads when it's on their Facebook page."
615,czhhvud,t3_43bqa1,t1_czh4vub,1454157796.0,gee_I_am_a_tree,1,0,0,0,1,"You and I had the same idea, I just went to archive it myself and saw that someone else did earlier this morning."
616,czhasd4,t3_43bqa1,t1_czh4vub,1454131384.0,BsKay,2,0,0,0,2,https://archive.is/vi7TO
617,czh6idv,t3_43bqa1,t1_czh4vub,1454122047.0,P2000Camaro,80,0,0,0,80,"I'm glad even 2 years ago there was people saying ""...You can't claim you own a broad and general concept.."" But what is fucking stupid is there were way more people saying ""They stole from you!"" ""You should sue!"" ""Shame on Ellen!"" 

These people are just seriously fucking brain-dead."
618,czjz2zh,t3_43bqa1,t1_czh6idv,1454352034.0,GoGlennCoco95,2,0,0,0,2,Whatever happened to 'public domain'? Seems like what they're doing shits on that concept entirely 
619,czj1mh6,t3_43bqa1,t1_czh6idv,1454280758.0,andya702,2,0,0,0,2,Their supporters are mostly made up of people under the age of 18. Cant be surprise with kids logic. 
620,czhazwm,t3_43bqa1,t1_czh6idv,1454131892.0,JjeWmbee,5,0,0,0,5,Same it's kind of crazy that they think they own a idea that's probably older than them.
621,czh8b2i,t3_43bqa1,t1_czh6idv,1454125808.0,BroadStreet_Bully5,14,0,0,0,14,How the fuck is that a unique and original idea? I feel dumber having read that thread.
622,czhasyj,t3_43bqa1,t1_czh8b2i,1454131424.0,JMEEKER86,6,0,0,0,6,"It's like the Apple ""round corners"" argument all over again."
623,czhd8un,t3_43bqa1,t1_czhasyj,1454138342.0,defrgthzjukiloaqsw,-4,0,0,0,-4,"Yeah, idiots not understanding how a **design** patent works again."
624,czh8xpo,t3_43bqa1,t1_czh8b2i,1454127179.0,_Booker,11,0,0,0,11,"As one person said, there was a show called Kids say the Darndest Things."
625,czh41r7,t3_43bqa1,t1_czh3w9f,1454117160.0,Enter_the_Dingus,493,0,0,0,493,"Literally no one is defending them.

Edit: the overwhelming majority of people in this thread are not defending these people. So I didn't understand why 
>**Before anyone continue to defend what the Fine Bros are doing**...

was necessary even if it is a copypasta. FFS 5 of the top 10 links on the front page are about this issue. Clearly no one here is on their side."
626,czhd8ye,t3_43bqa1,t1_czh41r7,1454138351.0,Captain_X24,1,0,0,0,1,"People are defending them, they're just not getting a lot of upvotes"
627,czhd79k,t3_43bqa1,t1_czh41r7,1454138196.0,mvm92,1,0,0,0,1,Nobody on Reddit is. But Reddit isn't the entire internet. As strange as that sounds even to me
628,czhd369,t3_43bqa1,t1_czh41r7,1454137828.0,Klimzel,1,0,0,0,1,">5 links 

Funny, 5 hours later I only see 1. Reddit mods on the deal perhaps? "
629,czhd623,t3_43bqa1,t1_czhd369,1454138087.0,Enter_the_Dingus,1,0,0,0,1,"No, links drop as they age. "
630,czhcd4j,t3_43bqa1,t1_czh41r7,1454135591.0,yukichigai,1,0,0,0,1,Nobody you see is on their side.  The shills show up and get downvoted to oblivion.
631,czhbynj,t3_43bqa1,t1_czh41r7,1454134443.0,nutterbutter90,1,0,0,0,1,He's adding that to his posts because when this news first hit people were defending Fine Bros. I think the majority of those people were misled by the PR at first and now see the reality of what is actually happening.
632,czhb6m5,t3_43bqa1,t1_czh41r7,1454132364.0,BlueTeamTV,1,0,0,0,1,"Philip DeFranco disagrees lol 

Check out @PhillyD's Tweet: https://twitter.com/PhillyD/status/693091853306990597?s=09"
633,czhaviw,t3_43bqa1,t1_czh41r7,1454131594.0,WeirderQuark,1,0,0,0,1,"I had thought Reddit was having an absurd overreaction before reading that comment and had figured it wasn't really a big deal. Even if people aren't vocal about it, there are people out there who don't understand why it matters."
634,czhaqeu,t3_43bqa1,t1_czh41r7,1454131258.0,Tkent91,1,0,0,0,1,If you go to their facebook page and read through comments on their post you'll find people defending them pretty regularly.
635,czhapz7,t3_43bqa1,t1_czh41r7,1454131230.0,Lira70,1,0,0,0,1,Maybe he meant in general though?  Some people have started defending them on youtube and such and claiming everyone is overreacting.  I just came across the videos by searching react trademark.
636,czhao90,t3_43bqa1,t1_czh41r7,1454131116.0,Lennon_v2,1,0,0,0,1,"I texted a friend who thought there was nothing bad about what they were doing, but it took two minutes for her to be hopping on the bandwagon of hate"
637,czh9h9d,t3_43bqa1,t1_czh41r7,1454128391.0,rod_munch,1,0,0,0,1,[Here's one guy](https://www.youtube.com/watch?v=96qxcYi4C0A)
638,czh8hxz,t3_43bqa1,t1_czh41r7,1454126215.0,RaineyJ,1,0,0,0,1,Except those wanting in on the whole thing...
639,czh87je,t3_43bqa1,t1_czh41r7,1454125599.0,Mackelkewl,1,0,0,0,1,"Unfortunately a sizable chunk of their 17 mil followers are all for this or indiferent.  They do have a group of followers.  Misguided, but following like blind sheep."
640,czh8gh2,t3_43bqa1,t1_czh87je,1454126127.0,Jeskid14,1,0,0,0,1,"At this point, I don't know who's a sheep and who's not. "
641,czh8v9z,t3_43bqa1,t1_czh8gh2,1454127030.0,chainer3000,1,0,0,0,1,*bleet*
642,czhbrt6,t3_43bqa1,t1_czh41r7,1454133916.0,Igneek,2,0,0,0,2,"It was useful, I didn't know anything about this drama"
643,czh898c,t3_43bqa1,t1_czh41r7,1454125698.0,Swagwise,2,0,0,0,2,"I posted a video about it yesterday, and got sent a bit of hate about it, so there are definitely some people thoughtlessly defending their internet heroes."
644,czh7tjg,t3_43bqa1,t1_czh41r7,1454124776.0,SoDamnShallow,8,0,0,0,8,"If you're not familiar with what is going on and saw the official FineBros response it's actually not hard to defend them, because most of the comments (including most of the heavily upvoted ones) don't actually explain how the FineBros are screwing people.

So what you end up seeing is a reasonable explanation of their actions, and a bunch of anonymous internet accounts saying they're bad without explaining why.

It was hard for me to tell if the outrage was reasonable, or if it was just the hivemind doing its thing. I had to dig for awhile before I got anything more substantial than opinions."
645,czh4vco,t3_43bqa1,t1_czh41r7,1454118747.0,Austin_Rivers,24,0,0,0,24,The things I wrote above were directly in response to the responses I got over the last day or two that have defended the Fine Bros. I just wanted to compile them together so that people who are thinking of making the same defense can read this.
646,czh7w89,t3_43bqa1,t1_czh4vco,1454124934.0,digitoba,-5,1,0,0,-5,"about this response you made: ""*They trademark every aspect of their â€œformatâ€ which already overlaps with what other reaction videos are.*""

I don't get it. They are trademarking the in-show separators (questions section for example), the graphics they use (KIDS vs FOOD has a dish as a logo, that would be trademarked) etc. What's wrong about that? Your response to this is what actually seems vague.

edit: [for anyone doubting if I'm a paid shill, I admit it, I am. This is my Finebros Corp identification](http://imgur.com/gwN0L5X) "
647,czh8561,t3_43bqa1,t1_czh7w89,1454125458.0,asdglaf,-1,0,0,0,-1,"You seem to be defending them quite a bit, huh?"
648,czh93lt,t3_43bqa1,t1_czh7w89,1454127541.0,Spartacus714,3,0,0,0,3,"The issue isn't necessarily what they could reasonably do with the trademark, defend their graphics and so forth. if they copyright the video i.e. the specific video like elders react to blankety-blank, those things are already covered in the copyright.

A trademark is a much wider protection, and would allow them to go after people using the format. As to whether they will or not, we don't know, but we know from the past that even without this legal protection they have gone after people.

It's an issue that they can use the trademark to defend it, even though even the most orange defenders of the fine bro'shave admitted that they did not invent the format, and it would be stupid evil to lock other people out of the format. 

It's like this, there are two late-night shows, the Tonight Show and Late-Night. The tonight show cannot use the late nights graphics or set, but it can use a similar set and similar graphics. But, if the late-night trademarked the format, the Tonight Show could not use anything similar. and that will be wrong, because it would be trademarking the idea of talking to celebrities on a couch with a host behind a desk on TV."
649,czh988c,t3_43bqa1,t1_czh93lt,1454127830.0,digitoba,-2,0,0,0,-2,">A trademark is a much wider protection, and would allow them to go after people using the format. 

>it would be trademarking the idea of talking to celebrities on a couch with a host behind a desk on TV.


but they aren't trademarking the very basic formula of ""people sitting behind monitor and reacting"" but the things I listed. If you want to link me to some proof that they are actually going to trademark the very basic concept of reacting to X video, I'd agree with you. Also, what do we know from the past that they have gone after people?
"
650,czh9ilc,t3_43bqa1,t1_czh988c,1454128474.0,Spartacus714,1,0,0,0,1,"No, that's what they are trademarking. If you watch this video or read the application for trademark, it spells that out very clearly. Their video on the subject is very deceitful about that. They say they'll allow videos of that type, but only in the ""React World Network"" and that otherwise it would be theft because someone worked to come up with the format or whatever.

Besides, all the things you say they need protection for are coming covered under copywriter, so WHY do they need a trademark for the piece as a whole?"
651,czh9rou,t3_43bqa1,t1_czh9ilc,1454129049.0,digitoba,2,0,0,0,2,"From what I see in the trademark office database, there are lots of trademarked ""REACT"", and Finebrothers' specifically says: 

""Entertainment services, namely, providing an on-going series of programs and webisodes via the Internet in the field of observing and interviewing various groups of people. ""

Wouldn't this mean that if you make a show for entertainment that's an on-going series of programs and webisodes in the field of interviewing various groups of people, you would have to share revenue, but that if you just use the word react, no problems would arise?

Also, you didn't provide my with any proof of them having already go after people."
652,czha37k,t3_43bqa1,t1_czh9rou,1454129770.0,Spartacus714,1,0,0,0,1,"Oh OK I see what's going wrong here.

If they wanted to trademark the term reacts or the word react, that actually would not be as big an issue as trademarking the format. As previously stated by bunch of people the idea of showing a group something and then asking them questions afterward for entertainment value has been around for quite some time, almost as long as broadcast television.

As for fine bro's going after people ""Stealing"" their format, check out this link to a screenshot of their Facebook page from a little while ago when they went after Ellen for using that format. http://onehallyu.com/topic/103241-fine-brothers-call-ellen-out-kinda-ridiculous/

I could probably dig for a little more, if you like but we're going to have to take a little break because I have to go home. I should be back on in 45 minutes to an hour.

I really appreciate that you're keeping this discussion very civil."
653,czhsav4,t3_43bqa1,t1_czha37k,1454180382.0,Mothcicle,1,0,0,0,1,"> trademarking the format

That's not what they're doing nor could they possible do that. They are trademarking the specific way they do reaction videos which includes all the graphics, music, and the rest of it. Only if other people would use a similar enough style as them to do reaction videos and use the term react could they use their trademark to try and stop it."
654,czhaavu,t3_43bqa1,t1_czha37k,1454130251.0,Sureiyaa,3,0,0,0,3,"They didn't ""go after Ellen."" so much as they threw a childish fit for a few minutes and then moved on with their lives. "
655,czh9van,t3_43bqa1,t1_czh9rou,1454129276.0,Sureiyaa,2,0,0,0,2,"You would have to do both, interview people for entertainment and call your show ""REACT"".

Now I don't know the specifics of trademark law but it also seems that you just can't use ""REACT"", that's what they're claiming. you should still be able to use ""react"", ""React"" or any other combination of capitalization. "
656,czha2ag,t3_43bqa1,t1_czh9van,1454129712.0,digitoba,2,0,0,0,2,"so you have to use the word REACT plus the formula of their videos... Seems pretty specific, no other youtuber has done something exactly like their show, so I don't see the problem. It's not like they have a Tonight Show/Late Show competition with anyone, and no one is trying to do it. They just went ahead and made sure you can't do the exact same program, while also expanding their business."
657,czha9o4,t3_43bqa1,t1_czha2ag,1454130173.0,Sureiyaa,1,0,0,0,1,"Well, the problem is that we don't know. The wording is vague enough that they can *potentially* apply it to several different kinda of videos and, depending on the judge, they could get results ranging fron having the trademark thrown out entirely to being able to prevent anyone from creating any kind of reaction video. That's certainly an extreme but it is what people are really scared of. "
658,czhajlq,t3_43bqa1,t1_czha9o4,1454130815.0,digitoba,2,0,0,0,2,"I was reading their FAQ and still, it doesn't seem that it's vague enough to believe they'll hunt anyone that dares to use the word REACT. As you said, we don't know, so I find it more of a compulsive reaction by reddit community to attack so much their business venture. I mean, I don't like them, though I watch some of their videos, but I like it much less when so many people rage about something they aren't totally sure about."
659,czh878q,t3_43bqa1,t1_czh7w89,1454125582.0,DarkResurgence,9,0,0,0,9,Nice try you fish eyed fuck
660,czh87ch,t3_43bqa1,t1_czh41r7,1454125587.0,n_s_y,24,0,0,0,24,"https://i.imgur.com/4K8UnwF.png

Wrong.  Read some of the tweets."
661,czhbajc,t3_43bqa1,t1_czh87ch,1454132641.0,xasper8,2,0,0,0,2,That Tweet was from Sept 19th 2014.
662,czhju2e,t3_43bqa1,t1_czhbajc,1454163948.0,n_s_y,2,0,0,0,2,...and they had support at the time.  Still do.  
663,czh4t2h,t3_43bqa1,t1_czh41r7,1454118618.0,topdeck55,41,0,0,0,41,"If you look, you can find them.

http://mashable.com/2016/01/28/the-fine-brothers-backlash/#9x0c0aFsIsqz

https://twitter.com/EquestrianIdiot/status/693224611744464897

https://twitter.com/DoctorOfFizz/status/692858851410862081"
664,czh7q8s,t3_43bqa1,t1_czh4t2h,1454124590.0,topdangle,20,0,0,0,20,">They are allowing creators the use of their licenses and a centralized community.

Wut? Does this guy believe youtube is Fine Bro's centralized community? Or will Fine Bros be offering free licensed material like artwork, music, template layouts and free footage to react to for ""aspiring"" ReactionWorldÂ©Â®â„¢LLC content creators and distributing and marketing their videos on their main channel?"
665,czhgslw,t3_43bqa1,t1_czh7q8s,1454153176.0,conzathon,2,0,0,0,2,"Yes actually. They said that they would give you graphics, production assistance, and promotion on their channel. But only if you give them a chunk of that React cash, sayin?"
