,id,link_id,parent_id,created_utc,author,score,controversiality,gilded,downs,ups,body
1520,czhbt2k,t3_43bqa1,t3_43bqa1,1454134018.0,Fantasticriss,1,0,0,0,1,What really stinks is I actually think the teens on the show are hilarious.  Jasser is legitimately funny.
1521,czhbtbg,t3_43bqa1,t3_43bqa1,1454134037.0,overweight_junker,1,0,0,0,1,this man definitely deserves an up voteâ€¦ 
1522,czhbume,t3_43bqa1,t3_43bqa1,1454134133.0,bambidal,1,0,0,0,1,"Not a regular visitor of this subreddit, so I never heard about you until today. But, i must say, based on this video/commercial, you sir ... rock.  Keep up the good work, and help those who (at the end of the day) are only making free PR for games.

Some of it will be bad PR, some of it will be good PR. It's up the the game creators to be at their best behaviour and try their best to ensure than the PR they do get for their games is only good PR. Underhanded tactics should not be tolerated."
1523,czhbvgx,t3_43bqa1,t3_43bqa1,1454134200.0,autolocksupport,1,0,0,0,1,"I chuckled at the end where he had to say ""this is advertising."" I had the Law Governing Lawyers last semester (lawyer ethics) and we learned all about soliciting. This is the kind of lawyer that inspires me to continue in my legal studies. A man who cares about his clients. The next time I open my casebook (this Sunday) I'm gonna put the extra effort in. I know this guy did all throughout school. "
1524,czhbw8n,t3_43bqa1,t3_43bqa1,1454134258.0,muscles4bones,1,0,0,0,1,"the fine bros have gone from ""kind of cool"" to certified ""fuccbois"" in record time."
1525,czhbwn2,t3_43bqa1,t3_43bqa1,1454134288.0,1ScorchedEarth,1,0,0,0,1,"America laws need to change.  How is even possible to trademark a common word used in English?  I mean, one day, some patent troll is going to trademark the phrase, ""good morning"" and what, we all them a nickel for each use?!"
1526,czhbwst,t3_43bqa1,t3_43bqa1,1454134300.0,Starrykosmik,1,0,0,0,1,"What kills me is how this will hurt the youtubers who have worked with them on the show. Will Markiplier be forced to take down his 8 million fan reaction video? He made that to show his fans how much he appreciates what they do for him! What about all the reaction videos pewdiepie or shane dawson made? will they be forced to take those down??? The people they are truly going to hurt are not just the youtube community but people who considered them to be their friends. This is so upsetting on so many levels, and it sickens me to think they believed it would be received well. At least their are people willing to step up."
1527,czhbzlk,t3_43bqa1,t3_43bqa1,1454134518.0,ReasonablyBadass,1,0,0,0,1,"Aww, now I can't enjoy the react^tm videos anymore :("
1528,czhc3i6,t3_43bqa1,t3_43bqa1,1454134824.0,Origamidragons,1,0,0,0,1,"Good for you, sir. I'm not even a creator, but this is just bullshit and I'm glad that there's someone willing to legally oppose it :)"
1529,czhc4rc,t3_43bqa1,t3_43bqa1,1454134923.0,routebeer,1,0,0,0,1,"OP, you're a great guy. It'd be nice if more professionals offered their services pro bono for situations like this!"
1530,czhc57g,t3_43bqa1,t3_43bqa1,1454134958.0,TejrnarG,1,0,0,0,1,"I never heard of those guys before, so now watched some of their videos to get an idea what thats all about. I couldn't even finish one of them. Seriously, why would anyone watch this crap anyway? Boring is an understatement."
1531,czhc5oz,t3_43bqa1,t3_43bqa1,1454134998.0,ianconspicuous,1,0,0,0,1,You're doing this all pro bono is there a way I can donate to the cause?
1532,czhc6q6,t3_43bqa1,t3_43bqa1,1454135082.0,maniclurker,1,0,0,0,1,"This is it. The moment you were born for. The moment you have prepared for. Realize your destiny!

We need a leader. 

His name is VideoGameAttorney. "
1533,czhc7i3,t3_43bqa1,t3_43bqa1,1454135143.0,Wice_Quispies,1,0,0,0,1,God... You have beautiful eyes...(No Homo)
1534,czhc7so,t3_43bqa1,t3_43bqa1,1454135165.0,7faces,1,0,0,0,1,I'm going to take a react video of me taking a shit.  Don't worry people I'll explain it to the judge.
1535,czhc971,t3_43bqa1,t3_43bqa1,1454135279.0,ph00p,1,0,0,0,1,"Reaction videos are the lowest form of entertainment, if you need to watch people watching things to get jollies..."
1536,czhcbdo,t3_43bqa1,t3_43bqa1,1454135449.0,MattLib,1,0,0,0,1,Don't worry h3h3 are probably making a video right now
1537,czhccsb,t3_43bqa1,t3_43bqa1,1454135565.0,Coldpronto,1,0,0,0,1,Front page? Must be a slow news day.
1538,czhce5j,t3_43bqa1,t3_43bqa1,1454135672.0,Kairatechop,1,0,0,0,1,"Til- people watch ""react"" videos. Am I the only one who hates seeing these in YouTube searches?"
1539,czhcemq,t3_43bqa1,t3_43bqa1,1454135708.0,lugeliar91,1,0,0,0,1,"Serious question: do the Fine Brothers pay the kids, teens, and elders they've built their empire on?"
1540,czhcfez,t3_43bqa1,t1_czhcemq,1454135772.0,Jellyfish15,1,0,0,0,1,Of course. 
1541,czhcfl7,t3_43bqa1,t3_43bqa1,1454135787.0,MaltaNsee,1,0,0,0,1,Someone please send this video to papa ethan. I know he can gather enough support to bring all this nonsense down
1542,czhcfuj,t3_43bqa1,t3_43bqa1,1454135808.0,PM_ME_YOUR_OWN_BOOBS,1,0,0,0,1,"In essence, all we have to do is react?

What if we're all in some worldwide fine bros video. ""World reacts to wrongful trademarks."""
1543,czhcgb8,t3_43bqa1,t3_43bqa1,1454135844.0,RonPaulaAbdulJubbar,1,0,0,0,1,"how can I help? I'm a vlogger and streamer, but don't do ""react"" videos."
1544,czhcibv,t3_43bqa1,t1_czhcgb8,1454136012.0,murdock129,1,0,0,0,1,"With such a bland and generic trademark, TheFineBros probably could list a typical vlogger and streamer as 'reacting' to something on screen if they so chose"
1545,czhcgxd,t3_43bqa1,t3_43bqa1,1454135895.0,murdock129,1,0,0,0,1,"MRW, as a small time Youtuber, these corporate twats try and act like they're god's gift to Youtube, and rebels against the establishment, while fucking over the entire rest of the community to line their own greedy pockets:

https://www.youtube.com/watch?v=bC2eImawV8E"
1546,czhcjez,t3_43bqa1,t3_43bqa1,1454136101.0,the_nin_collector,1,0,0,0,1,"Cool. I never watched their shit. Now if I ever come across, I know for sure never to watch it. "
1547,czhckfb,t3_43bqa1,t3_43bqa1,1454136189.0,User_Names_Matter,1,0,0,0,1,"Question: as a consumer of YouTube videos and ""reaction"" videos, do I have standing?

Or is it only content creators that have standing?"
1548,czhclb3,t3_43bqa1,t3_43bqa1,1454136264.0,SpyDad24,1,0,0,0,1,Your a good dude
1549,czhcmxa,t3_43bqa1,t3_43bqa1,1454136405.0,JoshHommeIsMyGod,1,0,0,0,1,"Seriously, how is this even a thing? This shit needs stopped before it ruins everything. Fucking greedy bastards.. find a way you build your fucking empire without some bullshit. I hope this act costs them everything. The internet doesn't forget."
1550,czhcn8s,t3_43bqa1,t3_43bqa1,1454136432.0,phukenh1,1,0,0,0,1,haha
1551,czhcp0m,t3_43bqa1,t3_43bqa1,1454136582.0,ScaryBilbo,1,0,0,0,1,*The hero we need.*
1552,czhcssn,t3_43bqa1,t3_43bqa1,1454136908.0,DonnieRobbs,1,0,0,0,1,"Ah, great, ah... thanks, ah... awesome. Ah. Ah. Ah. Ah. "
1553,czhcwjm,t3_43bqa1,t3_43bqa1,1454137240.0,mlnjd,1,0,0,0,1,seriously. i had no idea who fine bros was until this shit blew up. still... fuck em.
1554,czhcyni,t3_43bqa1,t3_43bqa1,1454137427.0,DeeJayFresh,1,0,0,0,1,Isn't this like somebody trying to trademark comedy? It's a genera of internet video not an actual thing.
1555,czhd05r,t3_43bqa1,t3_43bqa1,1454137559.0,marcm6246,1,0,0,0,1,"Damn, is this the demise of the Fine Bros? This is still new, i'm sure once many Youtubers find out about this, especially the ones they partner with for Youtubers React, they'll probably keep their distance from them. "
1556,czhd34d,t3_43bqa1,t3_43bqa1,1454137823.0,BOOMBOOMCHUCK,1,0,0,0,1,"Can't I just trademark ""React Universe"" and take everyone's money?

"
1557,czhd5o4,t3_43bqa1,t3_43bqa1,1454138055.0,PhyterNL,1,0,0,0,1,I didn't know about the Fine Bros before this and after reading about them I really wish it had stayed that way.
1558,czhd5xu,t3_43bqa1,t3_43bqa1,1454138077.0,Erockens,1,0,0,0,1,https://youtu.be/rQV1N0xwG4I     sorry I can't figure how to properly link on mobile. 
1559,czhd94v,t3_43bqa1,t3_43bqa1,1454138368.0,MyNameIsDon,1,0,0,0,1,"I'm not going to defend anybody here, but if the quantity of those kinds of videos was legally reduced, I would not complain."
1560,czhddnb,t3_43bqa1,t3_43bqa1,1454138781.0,brokenhalf,1,0,0,0,1,Sent you an email.
1561,czhdfx8,t3_43bqa1,t3_43bqa1,1454139001.0,codename_047,1,0,0,0,1,that's great work Keep it up
1562,czhdh93,t3_43bqa1,t3_43bqa1,1454139124.0,BruceyC,1,0,0,0,1,What's your knowledge of bird law like?
1563,czhdij0,t3_43bqa1,t3_43bqa1,1454139245.0,StarBeasting,1,0,0,0,1,Have you lot seen reaction vid? Dire. Fucking dire.
1564,czhdjht,t3_43bqa1,t3_43bqa1,1454139339.0,MrHabbershaw,1,0,0,0,1,"Pardon me for being uneducated, but why do people have a problem with the Fine Bros trademarking ""React"""
1565,czhdl90,t3_43bqa1,t3_43bqa1,1454139506.0,WeAreHolograms,1,0,0,0,1,KIDS REACT To REACT AROUND THE WORLD?!?! (Special Announcement) https://www.youtube.com/watch?v=O8Q0zlZpW5A
1566,czhdlqk,t3_43bqa1,t3_43bqa1,1454139552.0,waffleys,1,0,0,0,1,"or better known on reddit as...
Lmao, is that how you introduce yourself"
1567,czhdmor,t3_43bqa1,t3_43bqa1,1454139642.0,NocturnalQuill,1,0,0,0,1,"Could somebody with some level of legal expertise tell me how this whole shitshow will probably go down realistically? Even with how fucked up trademarks and intellectual property law is in the US, I refuse to believe that Fine Bros can get away with this."
1568,czhdn64,t3_43bqa1,t3_43bqa1,1454139690.0,TheCrimsonRock,1,0,0,0,1,"So I could get sued for starting a YouTube channel for science help called ""Chemicals React""?"
1569,czhdp5c,t3_43bqa1,t3_43bqa1,1454139888.0,hornibifida,1,0,0,0,1,this is embarrassing 
1570,czhdv6d,t3_43bqa1,t3_43bqa1,1454140499.0,r4and0muser9482,1,0,0,0,1,"If they made it, would a video of a chemical reaction also infringe on their trademark? Eg. check out how this sulphur reacts to water. Or would it apply strictly to human reaction videos? "
1571,czhe04d,t3_43bqa1,t3_43bqa1,1454141016.0,Indie__Guy,1,0,0,0,1,"So if this goes through, i can't upload my cousin reacting to 2 girls 1 cup? "
1572,czhe0u0,t3_43bqa1,t3_43bqa1,1454141089.0,Wo0d643,1,0,0,0,1,Humans by and large are assholes. 
1573,czhe1fa,t3_43bqa1,t3_43bqa1,1454141149.0,DingleberryStory,1,0,0,0,1,The fine bros is trying to be the next Maker Studios. Gather as much content and creators as possible and sell to Disney for a billy. There is no reason for anyone to join their network.
1574,czhe2eu,t3_43bqa1,t3_43bqa1,1454141252.0,SaraCloud1981,1,0,0,0,1,wow why does that word look so weird to me
1575,czhe4au,t3_43bqa1,t3_43bqa1,1454141449.0,captngimpy,1,0,0,0,1,As someone who has probably seen there video at some point in time but don't know who they are and won't be visiting their channel.  Please don't link other people to them.  By linking to them you are increasing revenue and increasing their worth. 
1576,czhe5gj,t3_43bqa1,t3_43bqa1,1454141579.0,mr_mojo_rye_sin,1,0,0,0,1,this guy.. much respect. 
1577,czhe7z3,t3_43bqa1,t3_43bqa1,1454141855.0,foamy2001,1,0,0,0,1,ELI5: why should I care about this?
1578,czhed3q,t3_43bqa1,t3_43bqa1,1454142412.0,spook327,1,0,0,0,1,"This looks like a reaction to the ""react"" trademark!  I think they've trapped you!

But seriously, you rock :D"
1579,czhegn6,t3_43bqa1,t3_43bqa1,1454142809.0,NotReallyARaptorYet,1,0,0,0,1,"ELI5 I guess? Sorry, I'm not quite sure I'm getting the point here. Are they trying to claim the word ""react"" or the format of reaction vids?"
1580,czhetsh,t3_43bqa1,t3_43bqa1,1454144325.0,EternityDuder,1,0,0,0,1,"I am trademarking the  term ""free help"""
1581,czheykv,t3_43bqa1,t3_43bqa1,1454144864.0,Reggae4Triceratops,1,0,0,0,1,This guy fucks.
1582,czhf0yl,t3_43bqa1,t3_43bqa1,1454145130.0,Bouda,1,0,0,0,1,"I submitted a bbc4 video that my friends and i were in to youtube since we cant access the video from the usa, amd i feel that this video is necessary to the history of my friends' subculture and 'for educational purposes'

i've gotten a dcma from bbc, can i fire back and defend my right for this to be kept?"
1583,czhf1p8,t3_43bqa1,t3_43bqa1,1454145209.0,Bouda,1,0,0,0,1,"Your reaction video is illegal, sir."
1584,czhf53c,t3_43bqa1,t3_43bqa1,1454145591.0,SyncTek,1,0,0,0,1,"So what I've gathered is that, currently:

If you make a reaction video featuring kids, teens, elders in a semi-episodic format, FineBros will send their lawyers after you.

And will work in collusion with youtube to get your content removed.

With the new trademark on REACT.

If you make any react videos in a semi-episodic format...say something like ""Australians react to American Barbies"" they will sent their lawyers after your from trademark infringement.

Is that correct?

Greedy bastards."
1585,czhf5ca,t3_43bqa1,t3_43bqa1,1454145619.0,RoyalDog214,1,0,0,0,1,"You people are breaking the law!

By the order of the United States Government, I demand that everyone of you obey the trademark agreement!"
1586,czhf5da,t3_43bqa1,t3_43bqa1,1454145622.0,Hagopinthebox,1,0,0,0,1,Pass me the popcorn! Shit got real! 
1587,czhf676,t3_43bqa1,t3_43bqa1,1454145713.0,bonkerdonkers,1,0,0,0,1,I thought this would be about stopping reaction videos stealing other creator's content
1588,czhfbfs,t3_43bqa1,t3_43bqa1,1454146326.0,rex1030,1,0,0,0,1,can someone explain why anyone would care about 'REACT' being trademarked
1589,czhfbq6,t3_43bqa1,t3_43bqa1,1454146361.0,royaldansk,1,0,0,0,1,"At some point, whoever owns BuzzFeed will probably fight it, right? I mean, hey.

Has someone trademarked ""Tries ___ Food"" yet, because the trying food format is maybe different enough."
1590,czhfbvy,t3_43bqa1,t3_43bqa1,1454146380.0,TheRichness,1,0,0,0,1,[Pretty funny video about the whole thing.](https://youtu.be/CRYnOPJiTaA)
1591,czhffwz,t3_43bqa1,t3_43bqa1,1454146864.0,Irish451,1,0,0,0,1,"Look I know this guy keeps saying pro-bono; but if any content creator is planning on using his services to secure their ability to make money based on his ability to win a legal case?  Pay this fucking guy.  Set up a GoFundMe or something.  If he wants to donate it to charity that's fine, but for fucks sake take care of this guy."
1592,czhfl7l,t3_43bqa1,t3_43bqa1,1454147510.0,jja2000,1,0,0,0,1,"Isn't this whole thing the exact same as Sony trying to copyright ""Let's play""?

Why would ""React"" be accepted then?"
1593,czhfl9u,t3_43bqa1,t3_43bqa1,1454147518.0,Wonderingperson,1,0,0,0,1,"I love how the majority of top comments are just a bunch of sarcastic and mememy(?) comments out for that karma grab.

Way to show you are serious about the topic people of reddit."
1594,czhfm8a,t3_43bqa1,t3_43bqa1,1454147636.0,antisouless,1,0,0,0,1,"We should make a series of ""reaction to react's reaction videos""
"
1595,czhfne0,t3_43bqa1,t3_43bqa1,1454147779.0,HarbingerME,1,0,0,0,1,"Serious, Can we start a gofundme page to pay for lawyer fees. I would gladly donate some of my schillings to the cause. Fuck the fine bros. bunch of cunts! "
1596,czhfxe9,t3_43bqa1,t3_43bqa1,1454149067.0,Barrier_Freeman,1,0,0,0,1,What a great guy
1597,czhg1j0,t3_43bqa1,t3_43bqa1,1454149600.0,richie74wells,1,0,0,0,1,"Is this the end of the fine Bros as we know it?? I think so, "
1598,czhgj6g,t3_43bqa1,t3_43bqa1,1454151882.0,sevenseventoeleven,1,0,0,0,1,REACT! Don't do it! When you want to suck to it.  REACT! Don't do it!  When you want to come.
1599,czhgui9,t3_43bqa1,t3_43bqa1,1454153413.0,DanLeSauce,1,0,0,0,1,"Although I've watched about 2 reaction videos my entire life, and don't care much for them or for that matter understand peoples fascination with them, I still agree that what The Fine Bros are trying to do is sickening and wrong and indicates a larger issue within the Youtube community and model that I am concerned about as a viewer. I can't get on board with the case you intend to make purely because it doesn't affect me directly, but if in some way myself or any other viewers with my opinions can assist in any way, do let us know! "
1600,czhgxli,t3_43bqa1,t3_43bqa1,1454153813.0,Cross_of_Coronado,1,0,0,0,1,I want to see these guys get fucked. This needs to be exposed. Also this just shows how fucking bad the courts are. This system is broken and everyone just accepts it
1601,czhh2rm,t3_43bqa1,t3_43bqa1,1454154451.0,Mox5,1,0,0,0,1,"Sony's attempt to trademark ""Let's Play"" recently gives credibility to your opposition as well :D

Good luck!"
1602,czhh6xy,t3_43bqa1,t3_43bqa1,1454154944.0,AoDPlays,1,0,0,0,1,This is just a social experiment by the Finebros so they can get the biggest react video of all time.
1603,czhhcwd,t3_43bqa1,t3_43bqa1,1454155646.0,ThrowawayForEmilyPro,1,0,0,0,1,"Can someone enlighten me please?

Say I gather around all my young siblings and shoot a ""Kids react to _____"" video and post it online through myself and not throughy 'finebros' community 'WORLD REACT'. Does that mean it'll be taken down due to the new trademark finebros are trying push onto us?

That's what I'm gettin' from all of this and it's absolute bollocks."
1604,czhhjef,t3_43bqa1,t3_43bqa1,1454156391.0,fumanchu4u,1,0,0,0,1,"soooo, what can I do to help. I think this is so the opposite of the spirit of you tube"
1605,czhhnom,t3_43bqa1,t3_43bqa1,1454156876.0,NITYW,1,0,0,0,1,"I completely agree that something like a reaction video shouldn't be a trademark.

But the Finebros controversy will also bring the spotlight on all the other reaction-channels on youtube. Because there are soooooo many people on youtube that effectively steal the real content by posting a ""reaction"" to a viral video which also contains the viral video itself.

So if the ""reactionists"" will be fighting the finebros, then the content creators will be fighting the ""reactionists""."
1606,czhhoji,t3_43bqa1,t3_43bqa1,1454156976.0,AcidJiles,1,0,0,0,1,How about we make it so you can't trademark real words fullstop. 
1607,czhhvn6,t3_43bqa1,t3_43bqa1,1454157776.0,quickerQuestioner,1,0,0,0,1,Question how will this impact the [facebook React library](https://facebook.github.io/react/)? 
1608,czhhwjr,t3_43bqa1,t3_43bqa1,1454157871.0,Wholemeal,1,0,0,0,1,Is the trademark just the word or is it the action of filming someone react to something?
1609,czhi3nq,t3_43bqa1,t3_43bqa1,1454158626.0,fongaboo,1,0,0,0,1,Can we trademark reacting to the Fine Bros trademark announcement?
1610,czhibs8,t3_43bqa1,t3_43bqa1,1454159439.0,Space-Punk,1,0,0,0,1,"I really don't like the fine bros.  I only watch their react videos, because they aren't in them, and I refuse to subscribe to them.  Every time I see their ugly faces I want to punch them, and IDK why cause they've never done anything that should make me dislike them.  They just always gave me an annoyed feeling."
1611,czhid4z,t3_43bqa1,t3_43bqa1,1454159570.0,Nikotiiniko,1,0,0,0,1,"When I first watched the video they made, I thought it was kinda bullshit but people would just go with it. Next day I wake up and holy shit, reddit and youtube launch a huge shitstorm against it! Did not expect this. Good job everyone. Even big youtubers are speaking against it in a manner I've never seen towards a target like Finebros. "
1612,czhiddk,t3_43bqa1,t3_43bqa1,1454159592.0,TheFox30,1,0,0,0,1,"If you don't have any clue what is all this about (like me...)

https://youtu.be/YN-vhZoO7wM"
1613,czhiil7,t3_43bqa1,t3_43bqa1,1454160069.0,Casteway,1,0,0,0,1,Reaction videos are fucking retarded.
1614,czhir36,t3_43bqa1,t3_43bqa1,1454160829.0,rabidbot,1,0,0,0,1,What a badass
1615,czhitpi,t3_43bqa1,t3_43bqa1,1454161052.0,bucky_8,1,0,0,0,1,What. A. Fucking. CHAMPION.
1616,czhitvv,t3_43bqa1,t3_43bqa1,1454161067.0,MrFactualReality,1,0,0,0,1,Form a Content Creator Union.
1617,czhivil,t3_43bqa1,t3_43bqa1,1454161208.0,Oderus_Scumdog,1,0,0,0,1,"Couldn't this easily be twisted to go after almost any kind of video in which a product, service, or thing is discussed and opinions shared?

For example, [Ashen's videos where him and Barry eat weird shit](https://www.youtube.com/watch?v=JuZbN9MTp-E) (and even just [Ashen's videos talking](https://www.youtube.com/watch?v=O84azcwyORE) about weird poundshop products) - Because the main bit of the entertainment comes from their reactions to the stuff they eat, wouldn't they be a target?

They aren't called reaction videos, I tend to watch them more because I find the stuff they show interesting, their reactions being even slightly funny is a bonus.


They are reaction videos, are they not?


Edit: Yeah...of course they are. What am I even talking about? That is the format of the video. I blame my hangover. Either way, fuck the FineBros trying to own something so generic and universal.


Edit 2: Ok, maybe they aren't trying to own *all* reaction videos but I feel like it's ambiguous enough that they might be able to go full corporate douche and start panning similar series."
1618,czhj7vf,t3_43bqa1,t3_43bqa1,1454162246.0,defuzzman29,1,0,0,0,1,"It's just yet another example of people pretending to be thinking of other people, when in fact they are doing it out of pure greed.  Ludacris "
1619,czhj7xe,t3_43bqa1,t1_czhj7vf,1454162250.0,ludabot,2,0,0,0,2,"She said she like the way I stick and make the bed rock

or how I lick and leave her twisted like a dreadlock, and it's on"
1620,czhj8pi,t3_43bqa1,t3_43bqa1,1454162313.0,CerealCigars,1,0,0,0,1,you are a good man!
1621,czhj94p,t3_43bqa1,t3_43bqa1,1454162348.0,Neloth,1,0,0,0,1,Does anyone have a list of sponsors to reach out to or boycott if necessary?
1622,czhj9ii,t3_43bqa1,t3_43bqa1,1454162379.0,Tugboatom,1,0,0,0,1,"We had a business owner in Baltimore copyright the term ""Hon"" a few years back. The negative reaction was swift."
1623,czhk4d8,t3_43bqa1,t1_czhj9ii,1454164683.0,RapidImpact,1,0,0,0,1,Except she won that case and sued/threatened to sue people who did use hon. So you should be able to see how trademarking something everyone inherently uses is bad
1624,czhx6zh,t3_43bqa1,t1_czhj9ii,1454189340.0,madafaku,2,0,0,0,2,You're right.  We need to get Gordon Ramsay to help us fight the Fine Bros!
1625,czhjat0,t3_43bqa1,t3_43bqa1,1454162483.0,UrbanPugEsq,1,0,0,0,1,What are you planning to do? File an opposition? File a letter of protest to try to draw the examiner's attention to the issues before the apps publish?  Or have these guys' apps already registered?
1626,czhjm3f,t3_43bqa1,t3_43bqa1,1454163354.0,Hohlraum,1,0,0,0,1,Are you kidding?  We're made up of gen-x and millennials.  We don't actually do stuff.  We just share a link to express our rage. ;)
1627,czhjpgj,t3_43bqa1,t3_43bqa1,1454163604.0,The_ThirdFang,1,0,0,0,1,"We just need to change the name. 

It's not kids react. 

It's children observing ""Tiny hamster eats burrito"". They aren't reacting but merely making emotional observation"
1628,czhk6ya,t3_43bqa1,t3_43bqa1,1454164868.0,whatmatey,1,0,0,0,1,i was told once that jokes in Christmas crackers were intentionally bad to give party guests a common 'enemy' to unite against.  Fine Bros have become nothing more than this Christmas cracker joke and i for one love it
1629,czhkily,t3_43bqa1,t3_43bqa1,1454165666.0,Topherhov,1,0,0,0,1,This guy should team up with the law hawk.
1630,czhklpo,t3_43bqa1,t3_43bqa1,1454165865.0,trevorlolo,1,0,0,0,1,Wow I never knew the fine bros were always hated here in Reddit. Changed my perspective about the fine bros...
1631,czhktnz,t3_43bqa1,t3_43bqa1,1454166385.0,Twitstein,1,0,0,0,1,"Alan Funt's Candid Camera kids segment. The audience watch kids reaction to things e.g. being given an [adult task](https://www.youtube.com/watch?v=sGyTbzjIUEg)   

This would come under 'React World' trademark on youtube."
1632,czhkxua,t3_43bqa1,t3_43bqa1,1454166655.0,orange_pear,1,0,0,0,1,"European IP lawyer here. My thoughts on this are:

The trade mark is probably invalid for lack of distinctive character and/or descriptiveness, unless the proprietor can show that it has acquired a distinctive character.

Use of the word ""reacts"" in the title of an online video is (prima facie) unlikely to be considered trade mark use (ie for the purposes of distinguishing goods/services of one undertaking from those of others), in which case there's no infringement. I'd be much more concerned by the use of the word in the name of a YouTube channel.

Someone posting a video with ""reacts"" in the title of people reacting to something ought in any event to be entitled to a defence on the basis that the sign was being used descriptively.

How does the US position differ?"
1633,czhl2bg,t3_43bqa1,t3_43bqa1,1454166928.0,PM_ME_FAV_PICS,1,0,0,0,1,"This is not fine, bro.  Seriously, though I am glad that there are a lot of people that are banding together for this.  Trademarks are there to protect the name of content that you created.  This is so that a billion people don't get to make a Napoleon Dynamite shirt and be able to piggy back off your success at providing a great product.  They are trying to monopolize a niche.  That is not okay and that is not trademarking's intended use."
1634,czhld35,t3_43bqa1,t3_43bqa1,1454167575.0,FantaPubedAndProud,1,0,0,0,1,We need Cliff Hutchinson!
1635,czhleox,t3_43bqa1,t3_43bqa1,1454167668.0,saragum,1,0,0,0,1,ohh...it's just attorneys.
1636,czhleqr,t3_43bqa1,t3_43bqa1,1454167671.0,theghostecho,1,0,0,0,1,"welp, I just unsubbed to them"
1637,czhlp5h,t3_43bqa1,t3_43bqa1,1454168275.0,Storm137,1,0,0,0,1,"The Finebros are crap. I used to like their videos but it's becoming obvious they coach the kids. Especially when they only show them certain things and obviously edited scenes to make something look ""lame"" to get them being negative."
