,id,link_id,parent_id,created_utc,author,score,controversiality,gilded,downs,ups,body
0,czh4s7x,t3_43bqa1,t3_43bqa1,1454118573.0,Mohammed420blazeit,3910,0,0,0,3910,Fine Bros is really bringing the community together as planned.
1,czh9qe9,t3_43bqa1,t1_czh4s7x,1454128967.0,goldenbones213,0,0,0,0,0,They brough balance to the force.
2,czhl3sb,t3_43bqa1,t1_czh4s7x,1454167015.0,drkpie,1,0,0,0,1,What'd they do. 
3,czhbk3i,t3_43bqa1,t1_czh4s7x,1454133328.0,GGRuben,1,0,0,0,1,The Shkreli strat!
4,czhgozn,t3_43bqa1,t1_czh4s7x,1454152710.0,ashmansol,2,0,0,0,2,I don't get this. I have seen kid reaction videos on UK TV back in the early 90's. Are they saying that reaction videos are their copyright?
5,czhjzzo,t3_43bqa1,t1_czhgozn,1454164373.0,Kwintty7,-1,0,0,0,-1,Trademark is not the same thing as copyright.
6,czhg8ad,t3_43bqa1,t1_czh4s7x,1454150488.0,zaphodi,2,0,0,0,2,"truly making history here, people will remember this moment as point where we looked back and collectively said, nope. "
7,czhfp2n,t3_43bqa1,t1_czh4s7x,1454147995.0,zaphodi,2,0,0,0,2,"people world wide will remember this moment

youtube being asshole at copyright content these guys are putting their faces out for similar crap, GOOD PLANNING guys."
8,czhk148,t3_43bqa1,t1_czhfp2n,1454164457.0,Kwintty7,0,0,0,0,0,Trademark is not the same thing as copyright.
9,czhga5f,t3_43bqa1,t1_czhfp2n,1454150726.0,zaphodi,2,0,0,0,2,our content is so special it will be remembered world wide for years to come.
10,czheb2a,t3_43bqa1,t1_czh4s7x,1454142189.0,Cloudfiv,2,0,0,0,2,"Kid's REACT to given choices:

https://www.youtube.com/watch?v=CvzhUmKPTM0"
11,czhaqbl,t3_43bqa1,t1_czh4s7x,1454131252.0,krkirch,2,0,0,0,2,And the community will make the FineBros' internet campaign crumble like steel beams reacting to jet fuel.
12,czi2gov,t3_43bqa1,t1_czh4s7x,1454199969.0,andytdesigns,2,0,0,0,2,This.such this. 
13,czhchb7,t3_43bqa1,t1_czh4s7x,1454135926.0,29a_hex,2,0,0,0,2,Was having the wrath of /u/videogameattorney brought upon you part of your plan? 
14,czhamki,t3_43bqa1,t1_czh4s7x,1454131007.0,ramrodthesecond,4,0,0,0,4,There needs to be a down vote button for channels like this. 
15,czh9h8t,t3_43bqa1,t1_czh4s7x,1454128390.0,GratinB,15,0,0,0,15,Plot Twist: They're doing this to push the copyright infringement ridiculousness over the top so we can finally see some changes to update and make sensible laws regarding the issue.
16,czhk1m4,t3_43bqa1,t1_czh9h8t,1454164493.0,Kwintty7,1,0,0,0,1,Trademark is not the same thing as copyright.
17,czh83sq,t3_43bqa1,t1_czh4s7x,1454125376.0,ninetalesz,143,0,0,0,143,oh god this is fucking hilarious
18,czhdwnl,t3_43bqa1,t1_czh4s7x,1454140653.0,Mrjasonbucy,124,0,0,0,124,"and at the same time loosing their own community too! [over 650,000 subs lost on 1/29](http://www.statsheep.com/react)

Edit: looks like statsheep isn't that reliable socialblade is more accurate. I wanted it to be true!"
19,czhllci,t3_43bqa1,t1_czhdwnl,1454168048.0,GlamorousHousewife,1,0,0,0,1,Well I just lost 20 minutes of my life searching all of my favorite YT channels to see how much they make. 
20,czhhock,t3_43bqa1,t1_czhdwnl,1454156955.0,FellatioAlger,5,0,0,0,5,They were too tight anyway.
21,czhlr4s,t3_43bqa1,t1_czhdwnl,1454168390.0,Storm137,3,0,0,0,3,Just unsubbed from both channels. :)
22,czhng4k,t3_43bqa1,t1_czhdwnl,1454171691.0,IWannaBeNumberT,5,0,0,0,5,That's just their REACT channel. Their main channel (where the main REACT series is) gained a few.
23,czhmivj,t3_43bqa1,t1_czhdwnl,1454169929.0,TWANGnBANG,5,0,0,0,5,"> over 650,000 subs lost on 1/29

statsheep.com is really bad at filtering YouTube API data.  Look at socialblade.com if you want a better idea of the actual impact (which is very little).  http://socialblade.com/youtube/user/react"
24,czi92rw,t3_43bqa1,t1_czhmivj,1454212702.0,Mrjasonbucy,1,0,0,0,1,Yeah you're right! I was wondering how they could loose so many in one day. I should have fact checked it. Thanks
25,czhkc7f,t3_43bqa1,t1_czhdwnl,1454165227.0,woah_m8,6,0,0,0,6,"Tbh many of them might also have been blocked by the fine bros. I saw some youtube comments in other videos, where people claimed to have been banned from their channel for criticising."
26,czhojyt,t3_43bqa1,t1_czhkc7f,1454173699.0,CupHead5998,7,0,0,0,7,"Yea they do that
for saying ""you guys should try to be a little more original."" i was banned"
27,czhk129,t3_43bqa1,t1_czhdwnl,1454164453.0,everydayimchapulin,6,0,0,0,6,"That's 650,000 of 5 million. I'm sure they don't care. They just got rid of the riff raff. The other 4.4 million are the sheep they want. "
28,czhkppo,t3_43bqa1,t1_czhk129,1454166130.0,Englishmuffin1,7,0,0,0,7,A 13% pay cut will definitely hurt them. 
29,czhl6rt,t3_43bqa1,t1_czhkppo,1454167199.0,methinkso,8,0,0,0,8,Subs don't count for anything if they're not active viewers. Views are what matter.
30,czhijup,t3_43bqa1,t1_czhdwnl,1454160184.0,bullet15963,19,0,0,0,19,"Jesus, am I reading that page right? Did they take down 38 videos in the past two weeks?"
31,czhho0c,t3_43bqa1,t1_czhdwnl,1454156916.0,Bernkastel-Kues,87,0,0,0,87,I was so sad to see I wasn't subscribed to them so I could unsubscribe :(
32,czh8j68,t3_43bqa1,t1_czh4s7x,1454126290.0,RitAblue,1332,0,0,0,1332,"They didn't account for this reaction...

Guess they forgot to add ""Reddit reacts"" to their trademark list. "
33,czhe59n,t3_43bqa1,t1_czh8j68,1454141558.0,leadabae,-1,0,0,0,-1,"Honestly I didn't either...after I saw the video initially I was like ""oh, cool, whatever..."" and I'm surprised to see this sub and more of the internet so upset over it."
34,czh99xk,t3_43bqa1,t1_czh8j68,1454127937.0,gorampardos,-7,0,0,0,-7,"""Reddit overreacts"" trademark would make more money."
35,czheu5y,t3_43bqa1,t1_czh8j68,1454144370.0,EternityDuder,1,0,0,0,1,"You're not allowed to use the word ""reaction"""
36,czhidru,t3_43bqa1,t1_czh8j68,1454159631.0,FloppY_,2,0,0,0,2,">They didn't account for this reaction...

Narcissists never do."
37,czhetds,t3_43bqa1,t1_czh8j68,1454144274.0,blastedin,2,0,0,0,2,"I am sure they did. They accounted for people freaking out, and for that the majority of their subscribers not caring, and for distractions and damage control. It's up to us to show them they miscalculated"
38,czhd2xg,t3_43bqa1,t1_czh8j68,1454137804.0,wgriz,2,0,0,0,2,"Let's genericize any other possible trademarks.

It's fine bro."
39,czhapwj,t3_43bqa1,t1_czh8j68,1454131225.0,meow0369,63,0,0,0,63,Reddit reacts would fall under their scheme. Come feb 2nd all reddit replies are going to be monetised.
40,czhc1aq,t3_43bqa1,t1_czhapwj,1454134658.0,UltimateShingo,64,0,0,0,64,So I can shitpost AND get rich doing it? Sign me up!
41,czk8jm4,t3_43bqa1,t1_czhc1aq,1454365290.0,MistrX,2,0,0,0,2,"[The FineBros hate him, click here to find out why!](https://gifsound.com/?gif=i.imgur.com/nO9akg4.gif&v=cS2DqJj_HDQ)"
42,czhlnfq,t3_43bqa1,t1_czhc1aq,1454168173.0,noobit,3,0,0,0,3,Learn how I got rich redditing with this one neat trick!
43,czhdmkg,t3_43bqa1,t1_czhc1aq,1454139631.0,Modern_Robot,9,0,0,0,9,"as long as they get their cut on everything you post, reaction or not"
44,czhgswf,t3_43bqa1,t1_czhdmkg,1454153209.0,Super_Vegeta,1,0,0,0,1,"Hell, it would be more than what I get now for posting shit."
45,czhjsql,t3_43bqa1,t1_czhgswf,1454163852.0,Modern_Robot,3,0,0,0,3,"maybe you should look into a branding deal then
"
46,czh90w5,t3_43bqa1,t1_czh8j68,1454127370.0,ItsMeCaptainMurphy,397,0,0,0,397,"We should make a ""Lawyers React"" series. I think I have a good idea for the first episode"
47,czheok3,t3_43bqa1,t1_czh90w5,1454143711.0,ITwitchToo,-1,0,0,0,-1,"Ahem, you mean ""attornies react"""
48,czig17c,t3_43bqa1,t1_czh90w5,1454232054.0,Jaggent,1,0,0,0,1,Ohhoho. This is going to get the WW3 started.
49,czhdva9,t3_43bqa1,t1_czh90w5,1454140509.0,Tvvister,3,0,0,0,3,That's a really good idea!  Mine.  TM.
50,czhc11y,t3_43bqa1,t1_czh90w5,1454134638.0,MilgramHarlow,8,0,0,0,8,"Netflix already made that show, it's called *Making a Murderer*."
51,czhc45x,t3_43bqa1,t1_czh90w5,1454134877.0,lycanthh,95,0,0,0,95,"Bro, how are we gonna make that if we don't have professional reacting advice and graphic resources?"
52,czhfmge,t3_43bqa1,t1_czhc45x,1454147662.0,timelyparadox,29,0,0,0,29,We also can't use their format so we cant use a chair and a desk and multiple people who reacts to it!
53,czhkl8v,t3_43bqa1,t1_czhfmge,1454165834.0,Wellhowboutdat,3,0,0,0,3,So one guy in an empty street looking forelorn? LETS DO IT
54,czhkpar,t3_43bqa1,t1_czhkl8v,1454166103.0,timelyparadox,2,0,0,0,2,Willing to license that?
55,czhlyew,t3_43bqa1,t1_czhkpar,1454168808.0,Wellhowboutdat,2,0,0,0,2,Nope but gonna trademark the ever-loving fuck out of it. Forelorn'd. 
56,czhhjpd,t3_43bqa1,t1_czhfmge,1454156428.0,Mrs_Brisby,5,0,0,0,5,"Well we could get a license to do it though, and they would even give us help in making it professional and provide graphic resources and...

Wait a minute....    GET OUT OF MY HEAD FINE BROS!


"
57,czh90j5,t3_43bqa1,t1_czh4s7x,1454127348.0,HadinGarKan,850,0,0,0,850,The easiest way to bring a community together is to give everyone something to ~~agree on~~ hate.
58,czhra5y,t3_43bqa1,t1_czh90j5,1454178598.0,Keegan320,1,0,0,0,1,Private Dancer? 
59,czhhqjm,t3_43bqa1,t1_czh90j5,1454157209.0,RecharginMyLaza,1,0,0,0,1,They learnt that from ISIS
60,czhfgld,t3_43bqa1,t1_czh90j5,1454146944.0,zaphodi,1,0,0,0,1,"always wondered if there was a guy on ISIS that goes like see, now you guys are all united in in hating us.
amidst of all this shit we do, something good came out of it, we ALL HATE ISIS"
61,czhebd2,t3_43bqa1,t1_czh90j5,1454142222.0,DamagedHells,1,0,0,0,1,Shkreli Effect
62,czhebae,t3_43bqa1,t1_czh90j5,1454142213.0,Stinkybelly,1,0,0,0,1,"That's how you know if she's ""the one"". You don't have to love all the same things but if you share hatred for the same things... You've got a keeper.."
63,czhe2z4,t3_43bqa1,t1_czh90j5,1454141310.0,RottMaster,1,0,0,0,1,"Exactly,  just like those dirty jews"
64,czhdqva,t3_43bqa1,t1_czh90j5,1454140058.0,dre__,1,0,0,0,1,It's the westboro baptist church thing all over again.
65,czhd32q,t3_43bqa1,t1_czh90j5,1454137819.0,Huop,1,0,0,0,1,"For real. It doesn't help that their ""reaction"" video was really obnoxious. They might as well have decided to high dive naked into a nest of cottonmouths."
66,czhc8fq,t3_43bqa1,t1_czh90j5,1454135217.0,alflup,2,0,0,0,2,"Any alliance whose purpose is not the intention to wage war is senseless and useless.

Adolf Hitler
"
67,czhbt6g,t3_43bqa1,t1_czh90j5,1454134026.0,skubasteve81,2,0,0,0,2,"Like the officer in Generation Kill and the grooming standard. Boosting morale in a war zone by making a huge deal out of something obviously ridiculous in that setting, so the troops have something they can all agree on and bond over no matter what other bullshit they're dealing with. It even forces their minds into the things that matter, since in order for someone to understand how insane it is to be screaming about moustaches and untucked shirts, they have to compare it to serious things like staying alive."
68,czhixxp,t3_43bqa1,t1_czh90j5,1454161413.0,stagfury,7,0,0,0,7,ALL HAIL BRITANNIA!
69,czhank4,t3_43bqa1,t1_czh90j5,1454131070.0,lic05,509,0,0,0,509,Make Youtube Great Again!
70,czhen9l,t3_43bqa1,t1_czhank4,1454143566.0,GreenHorseFumble,1,0,0,0,1,Confiscate their react videos!
71,czhcoad,t3_43bqa1,t1_czhank4,1454136521.0,othersidenakano,1,0,0,0,1,I do wonder if this will effect all the  new Patreon plugs I've been seeing.
72,czheydo,t3_43bqa1,t1_czhank4,1454144843.0,ShaneDAWS0N,2,0,0,0,2,BUILD THE WALL.
73,czhey6w,t3_43bqa1,t1_czhank4,1454144821.0,Painted_Sky,2,0,0,0,2,Remember that good old time without copyright laws on every single soundbyte? Let's bring that back! (rampant flame wars included)
74,czheh6v,t3_43bqa1,t1_czhank4,1454142874.0,helixflush,2,0,0,0,2,Fuck the Fine Bros to death!
75,czhfkiw,t3_43bqa1,t1_czhank4,1454147425.0,tanajerner,5,0,0,0,5,">Make YouTube hate again

FTFY"
76,czhdrbn,t3_43bqa1,t1_czhank4,1454140101.0,Chocobolove,8,0,0,0,8,"What if Trump just wants to unify the country by making *everyone* hate him?

He must be so disappointed that some people actually like the shit he says."
77,czhb40q,t3_43bqa1,t1_czhank4,1454132180.0,HadinGarKan,175,0,0,0,175,Don't tell me what to do.
78,czhf4tb,t3_43bqa1,t1_czhb40q,1454145561.0,eehee_alt,1,0,0,0,1,Make me. 
79,czhfbbs,t3_43bqa1,t1_czhb40q,1454146313.0,splntz,2,0,0,0,2,#blackwidowsmatter
80,czhdcv9,t3_43bqa1,t1_czhb40q,1454138704.0,froet213kil,59,0,0,0,59,"Yes, embrace the hate. >:-)"
81,czhdmpk,t3_43bqa1,t1_czhdcv9,1454139644.0,iRainMan7,17,0,0,0,17,I ~~love~~ hate whats going on.
82,czh271u,t3_43bqa1,t3_43bqa1,1454113730.0,VideoGameAttorney,5320,0,5,0,5320,tldw: I'm a trademark and video game attorney who usually offers a lot of free help over at /r/gamedev. I'm now offering pro bono help to oppose this ridiculous trademark. You can contact me at ryanmorrisonlaw.com or on twitter at @MrRyanMorrison if you are a streamer/content creator and feel the trademark REACT would cause you harm. 
83,czh8eba,t3_43bqa1,t1_czh271u,1454126000.0,Hippie_Trump,1,0,0,0,1,"PLEASE. Extend your tongue forth, so i may place with feather delicacy, a pube."
84,czh8e19,t3_43bqa1,t1_czh271u,1454125983.0,THEdrG,1,0,0,0,1,"If Big Time Movies Boys like Sean and Hayes of Hollywood Handbook endorse you, that's all I need to know."
85,czha99z,t3_43bqa1,t1_czh8e19,1454130150.0,TheMastahC,2,0,0,0,2,Speak on that
86,czh7yuo,t3_43bqa1,t1_czh271u,1454125086.0,nova-chan64,1,0,0,0,1,thank you for doing these kinds of things i know you probably hear it alot but you deserve it i havent needed your help in the game dev world (yet!) but if i ever do need some legal help ill probably come to you thank you again :D
87,czh7rt7,t3_43bqa1,t1_czh271u,1454124681.0,Bigboy_nicelegs,3,0,0,0,3,Omg someone I m actually friends with!! GO RYAN! 
88,czhrzmn,t3_43bqa1,t1_czh271u,1454179837.0,nutmegtell,2,0,0,0,2,"Hope this doesn't get buried but you can add it to your filings:

This is just a version of Kids Say the Darndest Things with Art Linkletter circa 1954.

https://m.youtube.com/watch?v=_UgLpRvX7Qk

Are the Fine brothers paying the Linkletter estate?

Or the OG reality react show, Candid Camera, from 1960 how original all this is."
89,czh9aok,t3_43bqa1,t1_czh271u,1454127986.0,lakeradio,2,0,0,0,2,Didn't you have advertisements on Hollywood Handbook?
90,czh8d6f,t3_43bqa1,t1_czh271u,1454125933.0,TheJetFuel,2,0,0,0,2,You helped the PMDT right?
91,czh7l4i,t3_43bqa1,t1_czh271u,1454124292.0,devotedpupa,5,0,0,0,5,Cracked and buzzfeed are huge and use React. Maybe reach out to them?
92,czh448x,t3_43bqa1,t1_czh271u,1454117288.0,slayez06,4,0,0,0,4,"You are awesome, enjoy pax and if you just want another signature I'm down."
93,czh8isa,t3_43bqa1,t1_czh271u,1454126266.0,Aycoth,3,0,0,0,3,"/u/Videogameattorney, why not organize a class action lawsuit for all the youtubers getting stuck down by illegal DMCA strikes? is that something you would be interested in?"
94,czh8f9r,t3_43bqa1,t1_czh271u,1454126055.0,justminenotyours,3,0,0,0,3,@videogameattorney -- attorney here with school (but no experience because i do tax law and other stuff) specialty in IP. I'd love to volunteer some of my time if you need a hand!
95,czh7yxg,t3_43bqa1,t1_czh271u,1454125091.0,methylatedVIM,5,0,0,0,5,You seem like a good guy. Keep it up!
96,czh35hc,t3_43bqa1,t1_czh271u,1454115468.0,Noerdy,23,0,0,0,23,Thank you for everything you have done for everyone. 
97,czh99tw,t3_43bqa1,t1_czh35hc,1454127930.0,,1,0,0,0,1,[deleted]
98,czh9g2g,t3_43bqa1,t1_czh99tw,1454128319.0,TheJrod71,1,0,0,0,1,Or help defend people in a job where content creators can get screwed over without an Attorney like him.
99,czh3taj,t3_43bqa1,t1_czh271u,1454116709.0,Austin_Rivers,29,0,0,0,29,"Hi Ryan, thanks for doing this. I wanted to add your contact information directly into my announcement replies but was afraid that the Fine Bros would use the ""no personal information"" rule to get my comment taken down. Thanks again for coming public, and I hope we can give those guys hell."
100,czh5czw,t3_43bqa1,t1_czh3taj,1454119718.0,ThisBetterBeWorthIt,9,0,0,0,9,"I wouldn't worry about that. I doubt they're on every platform removing comments, mainly because reddit doesn't have much in the way of systems to get comments removed. Your bigger worry is automod, which will flag up all emails and phone number and usually autoremove. "
101,czh84fc,t3_43bqa1,t1_czh271u,1454125415.0,troll__face,21,0,0,0,21,"You might be a good video game attorney, but how do you stack up in bird law?"
102,czhdvih,t3_43bqa1,t1_czh84fc,1454140531.0,Birdman_Attorney,7,0,0,0,7,"I'd go toe to toe on anyone in bird law.
"
103,czhecmg,t3_43bqa1,t1_czhdvih,1454142358.0,vidieowiz4,2,0,0,0,2,"1 year old, name checks out"
104,czh6t64,t3_43bqa1,t1_czh271u,1454122663.0,Lobster_Neck,29,0,0,0,29,"The fact that you're doing this for anyone and everyone is fantastic, it's great to see someone standing in stark opposition to the Fine Bros and working for the greater good of every content creator out there. I sincerely hope this works in your favor and draws attention to you for potential future clients, you deserve to make a living from what you do. "
105,czh6r1p,t3_43bqa1,t1_czh271u,1454122539.0,ricdesi,23,0,0,0,23,Attorneys React to React Reactions
106,czh6g4k,t3_43bqa1,t1_czh271u,1454121919.0,Throwaway_4_opinions,39,0,0,0,39,Can I just say you are amazing? I've seen you before this and frankly you are someone in unexplored territory clearing a path future attorneys will follow from your footsteps. Stay awesome.  
107,czh5xly,t3_43bqa1,t1_czh271u,1454120871.0,Sigma1977,88,0,0,0,88,"Heh, I was wondering whether someone like you existed :P

Are you helping anyone with video takedown-related issues at the moment? Because if that's in your ballpark there's a whole bunch of channels that could do with your advice.

Here's one for starters - there's been a couple of channels that received strikes on their videos for use of copyrighted material causing loss of revenue etc through false claims as the videos are very obviously fair use. The person who reported that video then publicly admitted to making a false claim out of spite or to teach the content creator 'a lesson'.

On that basis does the content creator at least have the grounds to have a lawyer contact that person or at most make a counter-claim for loss of revenue etc?"
108,czig3xe,t3_43bqa1,t1_czh5xly,1454232354.0,Jaggent,1,0,0,0,1,Was leafy in that group? Or Pyro?
109,czhdlze,t3_43bqa1,t1_czh5xly,1454139576.0,lesgeddon,1,0,0,0,1,"Do they have grounds to take them to court? Yes.

Will it cost more money than the lost revenue to do so? Odds are, more than likely.

In any case, Mr. VGA strictly deals with video game related legal stuff, but he can probably help with a referral for someone who does specialize in video copyright if the channel owners contacted him."
110,czh76z8,t3_43bqa1,t1_czh5xly,1454123453.0,Zogeta,46,0,0,0,46,This. There's a huge problem for this and a lot of creators don't know how to legally combat this.
111,czh8v1w,t3_43bqa1,t1_czh76z8,1454127018.0,Keinichn,10,0,0,0,10,"> a lot of creators don't know how to legally combat this.

Because you really can't. DMCA takedowns are fundamentally flawed. Anyone, for any reason, with little or no proof can order a take down and the site is required by law to follow through with it as soon as they're made aware. If the claim ends up being false, there's no recourse for the victim. You *might* be able to sue the person but it would be an uphill battle that may end up costing more than it's worth in both time and money."
112,czhbwjm,t3_43bqa1,t1_czh8v1w,1454134281.0,occams--chainsaw,8,0,0,0,8,how much do you need to spend to get far enough in the suit that you get their home address and then are able to stab them in the face and eventually let darwinism take its course?
113,czhg06q,t3_43bqa1,t1_czhbwjm,1454149426.0,AJockeysBallsack,4,0,0,0,4,I'd say stabbing them in the face pretty much dead-ends any Darwinism involving them. 
114,czhhwe0,t3_43bqa1,t1_czhg06q,1454157854.0,neuromonster,1,0,0,0,1,Survival of the fittest; all the non-douches were able to avoid being stabbed and passed their genes along.
115,czh8sv0,t3_43bqa1,t1_czh76z8,1454126882.0,hexydes,11,0,0,0,11,Google could probably provide a set of lawyers to help YouTubers sort this stuff out...but they don't...
116,czhc00u,t3_43bqa1,t1_czh8sv0,1454134552.0,sonofa2,7,0,0,0,7,"Why would or should they provide lawyers for every takedown notice, whether it be content ID (which is their own flagging software), or an actual DMCA takedown?  The number of takedowns is staggering, because the number of uploads is even more staggering.  It'd be a horrible financial decision to provide lawyers for everyone.


Also, Google actually is providing lawyers for a handful of clear fair use cases that are taken to court. It was a policy instituted in November."
117,czh9ahq,t3_43bqa1,t1_czh8sv0,1454127973.0,Sonols,8,0,0,0,8,Its like they own youtube or something.
118,czh7lai,t3_43bqa1,t1_czh271u,1454124302.0,eviscos,23,0,0,0,23,"Just wanted to say, I very much appreciate all the work you've put into /r/gamedev"
119,czh5hny,t3_43bqa1,t1_czh271u,1454119982.0,DiogenesTheHound,444,0,0,0,444,">Video game attorney

**OBJECTION!**"
120,czhelmv,t3_43bqa1,t1_czh5hny,1454143384.0,nermid,1,0,0,0,1,[OBJECTION](http://objection.mrdictionary.net/go.php?n=8153845)!
121,czhdn1k,t3_43bqa1,t1_czh5hny,1454139675.0,nhremna,1,0,0,0,1,something something milkshake
122,czha6dn,t3_43bqa1,t1_czh5hny,1454129971.0,Beniskickbutt,1,0,0,0,1,Overruled 
123,czh911e,t3_43bqa1,t1_czh5hny,1454127380.0,poop_giggle,1,0,0,0,1,Patched.
124,czh8br6,t3_43bqa1,t1_czh5hny,1454125849.0,Deathdeathanddeath,1,0,0,0,1,I just pictured Matlock saying that
125,czh8bk4,t3_43bqa1,t1_czh5hny,1454125837.0,w4hammer,1,0,0,0,1,Overruled.
126,czh7ycc,t3_43bqa1,t1_czh5hny,1454125056.0,brocahantas,1,0,0,0,1,Move to strike!
127,czhdog8,t3_43bqa1,t1_czh5hny,1454139816.0,ICUNURGAY,2,0,0,0,2,Take that!
128,czhcn17,t3_43bqa1,t1_czh5hny,1454136414.0,HollowPsycho,2,0,0,0,2,[That won't fly here Mr DiogenesTheHound](http://objection.mrdictionary.net/go.php?n=8153801)
129,czhbdgt,t3_43bqa1,t1_czh5hny,1454132851.0,peterwestinghouse,2,0,0,0,2,https://youtu.be/1RrII-ZSNI8
130,czhcjwz,t3_43bqa1,t1_czh5hny,1454136146.0,dp4200,5,0,0,0,5,*music doesn't stop*
131,czhdpwh,t3_43bqa1,t1_czhcjwz,1454139962.0,WWEBernieSanders,5,0,0,0,5,"SHIT. Whelp, better reload my save file. *again*"
132,czhbbc5,t3_43bqa1,t1_czh5hny,1454132698.0,im_not_afraid,14,0,0,0,14,[**OVERRULED**](http://i.imgur.com/ixKMzvs.gif)
133,czhff9v,t3_43bqa1,t1_czhbbc5,1454146784.0,JasonsThoughts,1,0,0,0,1,Sidebar
134,czhme67,t3_43bqa1,t1_czhff9v,1454169673.0,im_not_afraid,2,0,0,0,2,what. is this spam?
135,czis39b,t3_43bqa1,t1_czhme67,1454264932.0,JasonsThoughts,2,0,0,0,2,"No, i was just trying to be funny.

https://en.wikipedia.org/wiki/Sidebar_%28law%29

http://www.imdb.com/title/tt2637276/quotes?item=qt2525893
"
136,cziskje,t3_43bqa1,t1_czis39b,1454265753.0,im_not_afraid,2,0,0,0,2,"You got me, nice one"
137,czh8yoa,t3_43bqa1,t1_czh5hny,1454127238.0,butthead,19,0,0,0,19,http://i.imgur.com/tl5GjQ2.gif
138,czhaajh,t3_43bqa1,t1_czh8yoa,1454130229.0,beester87,2,0,0,0,2,*furiously opens and closes jacket*
139,czh9viv,t3_43bqa1,t1_czh8yoa,1454129290.0,snuffbox,6,0,0,0,6,I think you are the only one who got the joke.
140,czhd6nd,t3_43bqa1,t1_czh5hny,1454138140.0,Awesomekip,10,0,0,0,10,"HOLD IT!

TAKE THAT!"
141,czh8wk8,t3_43bqa1,t1_czh5hny,1454127109.0,shootandreload,10,0,0,0,10,"I'll allow it this time, but watch yourself Mc'coy"
142,czhaxyz,t3_43bqa1,t1_czh5hny,1454131759.0,notquiteotaku,30,0,0,0,30,**HOLD IT!**
143,czhb7ck,t3_43bqa1,t1_czhaxyz,1454132413.0,im_not_afraid,19,0,0,0,19,*slams table*
144,czhf00g,t3_43bqa1,t1_czhb7ck,1454145022.0,freemefromyou,1,0,0,0,1,**Sustained!!**
145,czig3kn,t3_43bqa1,t1_czhb7ck,1454232314.0,Jaggent,2,0,0,0,2,Can someone explain the referrence?
146,czinlu9,t3_43bqa1,t1_czig3kn,1454256900.0,im_not_afraid,4,0,0,0,4,Ace Attorney. A series of video games.
147,czjj30j,t3_43bqa1,t1_czinlu9,1454316471.0,Jaggent,1,0,0,0,1,"XD.

Was the ""GET WET! GET. WET!"" joke mentioned here? I found the original FYI. If someone wants ask."
148,czjuwom,t3_43bqa1,t1_czjj30j,1454346140.0,im_not_afraid,1,0,0,0,1,Now I'm lost. Can you explain the get wet reference? You could be referencing the wet noodle shop in the first game or the noodle salesman in the fourth game.
149,czjv1q4,t3_43bqa1,t1_czjuwom,1454346344.0,Jaggent,1,0,0,0,1,"Naw I mentioned a sex fuck up where a girl met this guy and he jackhammer fingered her, looked at the pussy and screamed like a soldier ""**GET WET! GET. WET!**"""
150,czjv8pl,t3_43bqa1,t1_czjv1q4,1454346619.0,im_not_afraid,1,0,0,0,1,**SIR. YES SIR**^^^(squeeze)
151,czjwlrc,t3_43bqa1,t1_czjv8pl,1454348575.0,Jaggent,1,0,0,0,1,**MA'AM. YES MA'AM** ^^Ejaculate
152,czh7mlp,t3_43bqa1,t1_czh5hny,1454124378.0,HerrXRDS,113,0,0,0,113,"Objection denied. OP, you may continue. "
153,czh8gch,t3_43bqa1,t1_czh7mlp,1454126120.0,ahumblesloth,21,0,0,0,21,"It's ""overruled"" I think. "
154,czhapdp,t3_43bqa1,t1_czh8gch,1454131191.0,itsNOSAJ,1,0,0,0,1,This is correct
155,czh8doa,t3_43bqa1,t1_czh7mlp,1454125963.0,,91,0,0,0,91,[deleted]
156,czhaxze,t3_43bqa1,t1_czh8doa,1454131760.0,NecroJoe,0,0,0,0,0,"I'm sure this is something from something I'm not familiar with, but maybe Endor is just what the out-of-towers call Kashyyyk, but the beings that like on Kashyyyk only call it Kashyyyk? (Kinda like Germany v. Deutschland)"
157,czhbep1,t3_43bqa1,t1_czhaxze,1454132940.0,,2,0,0,0,2,[deleted]
158,czhbxn7,t3_43bqa1,t1_czhbep1,1454134365.0,NoTimeForThat,1,0,0,0,1,"I shall now Mangina Monologue for 26 days, at which point we shall deliberate."
