,id,link_id,parent_id,created_utc,author,score,controversiality,gilded,downs,ups,body
1037,czhlkt5,t3_43bqa1,t1_czhifmz,1454168017.0,Nimphious,4,0,0,0,4,"Since when did the Xerox system not have overlapping windows? The whole point of windows is that they overlap. Otherwise they're not windows, they're just split workspaces which other operating systems had been using long before Xerox's GUI.

The problem was the implementation sucked. All the ideas were there and working, but they wouldn't sit well on a cheaper/less powerful computer like Lisa.

~~As for context menus, almost every single window in Xerox Star had a conext menu icon (one of the first ever uses of the now ubiquitous ""hamburger"" icon) which opened up a contextual menu. Sure there weren't contextual menus for things like interacting with files or just generally right-clicking other things, but it was definitely there.~~

~~Also, cut copy and paste functionality was present, I'm not sure where you're getting your information, but none of your accusations are correct.~~ *(edit: incorrect, existed on Star but not Alto which was the system that preceded Apple's)*

I don't know why you're trying to nit-pick a single point out of the parent comment's content, but that's neither the point of the comment nor helpful since your argument doesn't change the actual underlying point. You're either being a fanboy and lying, or you've just got your info wrong, either way your comment isn't really helpful here."
1038,czhp8s3,t3_43bqa1,t1_czhlkt5,1454174969.0,BorgDrone,-4,0,0,0,-4,"
>Since when did the Xerox system not have overlapping windows? 

Well, it did have overlapping windows, it just couldn't draw in them, so that's pretty useless. 


>As for context menus, almost every single window in Xerox Star had a conext menu icon 

Sure. But the Xerox Star was not the machine that Jobs saw, the Star is a later development. Jobs was shown the Alto and D-machines. Also, I wasn't talking about context menus but pull-down menus. 

>Also, cut copy and paste functionality was present, 

In the star, not in the Alto. The Star was released 8 years after the Alto. 

> I'm not sure where you're getting your information, but none of your accusations are correct.

[Bruce Horn](http://www.folklore.org/StoryView.py?project=Macintosh&amp;story=On_Xerox,_Apple_and_Progress.txt&amp;topic=Software%20Design&amp;sortOrder=Sort%20by%20Date). One of the programmers who worked on the original 128K Mac and who used to work at Xerox. 

>I don't know why you're trying to nit-pick a single point out of the parent comment's content, 

Because it's wrong. I can't stand people spreading misinformation. "
1039,czhqkbn,t3_43bqa1,t1_czhp8s3,1454177324.0,Nimphious,3,0,0,0,3,"Yeah fair enough. You're totally right. I didn't know the machine they were referring to was the Alto not the Star, but I never looked that deeply into it.

Also, what's the distinction between ""pull down menus"" and context menus? Am I missing something here?

I totally understand where you're coming from with the misinformation thing, too, I'm similar, however my point about derailing the other comment with specifics when as a general point it was true. Regardless of how much of the Xerox GUI they took inspiration from they still did, and Jobs himself even mentions that he was suprised when he saw the GUI systems when being shown around at Xerox and the way he describes the encounter and his reaction to it suggests it was a change of mindset for him, how he had his software engineers study the system. Are you saying that's not at the very least taking notes and thereby inspiration from the system?

Regardless of how much they copied or mimicked, the fact of the matter is that they did, and that's all the other comment stated. No more or less.

So why would you attack that comment in particular, especially since you're so bent on people not spreading misinformation, when that comment isn't doing that at all?"
1040,czifq8y,t3_43bqa1,t1_czhqkbn,1454230842.0,BorgDrone,-1,0,0,0,-1,"
>Also, what's the distinction between ""pull down menus"" and context menus? Am I missing something here?

Pull down menus are the menu's at the top of your screen (File/Edit/...) that you pull down. Context menu's are a later invention; it's the right-click menu that shows actions that are relevant in the context of the thing you clicked on. 

>I totally understand where you're coming from with the misinformation thing, too, I'm similar, however my point about derailing the other comment with specifics when as a general point it was true. 

But the specifics are the most important part. 

> Regardless of how much of the Xerox GUI they took inspiration from they still did, and Jobs himself even mentions that he was suprised when he saw the GUI systems when being shown around at Xerox and the way he describes the encounter and his reaction to it suggests it was a change of mindset for him, how he had his software engineers study the system. Are you saying that's not at the very least taking notes and thereby inspiration from the system?

That's exactly what he did. And that is exactly what they didn't do in the slide-to-unlock case. It was exactly as you said a change in mindset, a new way of doing things; eyes were opened. He then took these new insights and designed a computer around those ideas, often evolving them, taking them to their logical next step. 

With the slide-to-unlock there was no new insight, they didn't go 'wow, I never imagined you could do that', they didn't take a new idea and apply it to their product. They just copied a feature from the iPhone because they were trying to make a cheap knockoff. "
1041,czkj0mf,t3_43bqa1,t1_czifq8y,1454381393.0,Erzerker,1,0,0,0,1,Fun fact: [Apple did not invent slide-to-unlock](http://www.bbc.com/news/technology-18709232).
1042,czpp3vg,t3_43bqa1,t1_czhetbs,1454733430.0,Trot1217,1,0,0,0,1,"> ISPs love government subsidies which allow them to lay down their networks, and they love legal constructions granting them a local monopoly. But when the government wants to make rules about net neutrality, or demand they fulfill their end of the deal they signed for the subsidies, or demands broadband to actually have a decent speed, or wants to change the rules to boost competition, they whine about government intervention being evil, and about how scared the free market is.

This one wouldn't be a fucking problem if the government didn't give them monopolies in the first place."
1043,czlxr49,t3_43bqa1,t1_czhetbs,1454475271.0,PuffaTree,1,0,0,0,1,Thanks for the great read Ben.
1044,czk8knp,t3_43bqa1,t1_czhetbs,1454365330.0,jnd923,1,0,0,0,1,"Totally agree with you that this happens all the time. Not trying to be a stickler but Apple licensed that technology from Xerox. Apple was the hot tech company at the time and everyone wanted a piece of it so Jobs sold Xerox 100,000 shares for $1 million which was a great deal and pre-IPO. Bill Gates and Microsoft pushed the story that Apple had stolen it too when they stole the idea from Apple but it wasn't true. Xerox ""opened the kimono"" to Steve Jobs in return for allowing them to buy some Apple Stock before it was publicly available."
1045,czjv4w6,t3_43bqa1,t1_czhetbs,1454346468.0,da3da1u5,1,0,0,0,1,"I would speculate this pattern happens because companies start off as a private entity, and that owner may be socially conscious and motivated by doing good *in addition* to making profit, but once that companies grows to a certain size and now has investors to think about it changes to a purely profit centric operation.

Altruism then takes a back-seat to quarterly profits and any initiatives that eat into dividends is viewed very negatively by those investors."
1046,czjmbb7,t3_43bqa1,t1_czhetbs,1454329588.0,aardvarkfilms,1,0,0,0,1,Pretty sure Steve Jobs stole that quote - http://quoteinvestigator.com/2013/03/06/artists-steal/
1047,czjmnlw,t3_43bqa1,t1_czjmbb7,1454330654.0,JustCallMeBen,1,0,0,0,1,"He never said he came up with it, he himself attributed it to Picasso: https://www.youtube.com/watch?v=CW0DUg63lqU

"
1048,czjgyf5,t3_43bqa1,t1_czhetbs,1454309256.0,TacticalMelonFarmer,2,0,0,0,2,humans can only succeed if it's at the expense of other humans
1049,czj26ru,t3_43bqa1,t1_czhetbs,1454281685.0,FantasticMrFox88,10,0,0,0,10,"Calling TheFineBros a company is a joke though. They're content creators for YouTube. I guess in some ways these days that qualifies as an entertainment company. Maybe I'm naive but I always thought that YouTube's whole ethos as a community was that everybody gets to make content, so content creators generally never have pulled this kind of crap before."
1050,czjc883,t3_43bqa1,t1_czj26ru,1454298703.0,,3,0,0,0,3,"Most major entertainment companies have purchased companies created around youtube and online media. Make no mistake they're worth a lot of money at the moment. Maker Studios which owns Polaris was bought out by Disney for $500 million. The Philip Defranco Network which is Sourcefed, SourcefedNerd, The Philip Defranco Show is owned by Discovery."
1051,czjadjj,t3_43bqa1,t1_czj26ru,1454295361.0,redroverdover,10,0,0,0,10,"Oh it definitely counts a company, or entertainment company. They make millions of dollars. You can hold your nose up and be snooty at these guys, but its meaningless. They are legit, this is serious, and fuck them for what they do."
1052,czjqvjq,t3_43bqa1,t1_czjadjj,1454339957.0,Innundator,8,0,0,0,8,Exactly.  Which is why it's nice seeing them bleed for this.
1053,czj4bok,t3_43bqa1,t1_czhetbs,1454285120.0,dimcarcosa,19,0,0,0,19,Chaos isnâ€™t a pit. Chaos is a ladder.
1054,cziynh0,t3_43bqa1,t1_czhetbs,1454275984.0,mike231002,20,0,0,0,20,"I loved your quote ""small company climbs the ladder, and once they are up there, they want to kick the ladder down""."
1055,czirz6p,t3_43bqa1,t1_czhetbs,1454264741.0,dhantana,82,0,0,0,82,"""You either die a hero or you live long enough to see yourself become the villain""?"
1056,czh7yd1,t3_43bqa1,t3_43bqa1,1454125057.0,TexasSteve3452345,350,0,0,0,350,"These trademark issues seem trivial but as a person who has been harassed with a lawsuit, it is no joke.

I had to shut down my entire business to avoid going to court. The trademark owner will come in and make a bunch of claims ""you are violating our trademark and deriving monetary gain from it, therefore we have a claim to those profits"" etc. Then they pretty strong arm you into doing whatever they say to avoid the lawsuit. They can even make bogus claims against you and have the most shittiest of evidence and they can still drag you into court. It is a nightmare. 

The reason I had to shut down my business was because the cost of litigation is so expensive. My company was a tiny startup that had most of our capital invested in R&D (creating the product, basically). When we finally launched, sales were growing steadily and that is when this organization showed up with their claims against us. We were their competitor so they pretty much used the courts to get rid of their competition. Pretty outrageous.

So what does this mean for you tiny YouTube content creators? It means you will be extorted constantly with lawsuits. You will have absolutely no way to fight them, unless you have deep pockets. The amount of money you are making from youtube ads is next to nothing compared to the cost of litigation. Also, what they will do is enforce the trademark through youtube so any money that used to go your partner account will just go straight to them. They are pretty much getting you idiots to make content for them and they are going to grab all the ad dollars from you!"
1057,czheiil,t3_43bqa1,t1_czh7yd1,1454143023.0,seishi,-12,0,0,0,-12,Sorry to hear about your Etsy shop.
1058,czhhpy9,t3_43bqa1,t1_czh7yd1,1454157140.0,gobol,1,0,0,0,1,"I would rather kill someone than give in like that.

Also it's extremely easy to just upload two more videos for every one they attempt to take down. And you can also report their videos for infringement using false claims."
1059,czhg9oz,t3_43bqa1,t1_czh7yd1,1454150667.0,Snote85,1,0,0,0,1,"But their name has ""Intellectual"" right in there! How could they be against these ""Ventures""?"
1060,czhay6g,t3_43bqa1,t1_czh7yd1,1454131775.0,TheYear2045,15,0,0,0,15,Sorry to hear about that man. Hope you went out and started another venture
1061,czh9nhq,t3_43bqa1,t1_czh7yd1,1454128782.0,OktoberStorm,42,0,0,0,42,"Would be interesting to know the details of this situation, though..."
1062,czh6ju9,t3_43bqa1,t3_43bqa1,1454122131.0,FadedFellow,156,0,0,0,156,"Not sure if you could, but if you reached out to a couple large and small youtube channels they might have your back. I Hate Everything probably would since his account was nearly deleted off of youtube for good, and he seems to hate lazy reaction channels that just make money off of other youtuber's videos. h3h3 productions is partly a reaction channel so he would definitely be mad about this. IDubbztv does reactions, while a lot of them are not on YouTube videos, but Kickstarter projects. Either way he would most likely still be affected. These are just some of the great channels I know, and who would be affected. Please stop them. I hope you can find someone."
1063,czhw1wh,t3_43bqa1,t1_czh6ju9,1454187185.0,rambogini2,2,0,0,0,2,"IDubbztv had already commented on FineBros' announcement video. I'm sure he'll definitely be on board with anything that opposes it. 

"
1064,czhhb66,t3_43bqa1,t1_czh6ju9,1454155443.0,Bobthemime,2,0,0,0,2,"TotalBiscuit and his wife would be good to approach too, as well as Jimquisition, as they have React type videos to food, greenlight trailers, game trailers, shitty stuff that happened in the game industry.

When they targeted Ellen, they showed just how broad their trademark covers.  I mean making a video showing kids old technology isn't unique to Fine Bros."
1065,czhea0r,t3_43bqa1,t1_czh6ju9,1454142078.0,zhegames,3,0,0,0,3,Hell. Even Jon Tron is reacting to video games.
1066,czhb7fy,t3_43bqa1,t1_czh6ju9,1454132420.0,Private_Pull,5,0,0,0,5,"I think GradeAUnderA might also be willing to talk about it since he's made a lot of videos attacking things on Youtube that make no sense. His channel is growing pretty fast and his videos tend to get a lot of views, so it would be nice to have him make a video over this matter in addition to people like h3h3 productions and IHE."
1067,czh898g,t3_43bqa1,t1_czh6ju9,1454125698.0,the_nice_nerd,34,0,0,0,34,"I think we might be able to bring Jacksfilms into this. He defended the Fine Bros during his battle with the equally terrible Jinx, but I know he thinks that this is too far. "
1068,czh8lfk,t3_43bqa1,t1_czh898g,1454126427.0,MisinformationFixer,-11,0,0,0,-11,"That guy is a PewDiePie clone, he can't do shit."
1069,czhil29,t3_43bqa1,t1_czh8lfk,1454160292.0,squirrelguys,1,0,0,0,1,Even so if pewdiepie says something about going after the fine bros you know his army of 12 year olds will just barrage their pages
1070,czhcsx7,t3_43bqa1,t1_czh8lfk,1454136920.0,Graceclaw,5,0,0,0,5,LOL. You've obviously never seen one of Jack's videos.
1071,czh9p9f,t3_43bqa1,t1_czh8lfk,1454128893.0,the_nice_nerd,11,0,0,0,11,"Dude, are you crazy? 

Jacksfilms doesn't shout to be ""funny"", he doesn't make gaming videos unless it's satire, he's American, he does parodies, and he's all around nothing like Pewds."
1072,czig3l9,t3_43bqa1,t1_czh9p9f,1454232316.0,TIGHazard,5,0,0,0,5,I think he's getting confused between Jacks films and JackSepticEye
1073,czhct1u,t3_43bqa1,t1_czh9p9f,1454136933.0,Graceclaw,5,0,0,0,5,Boom roasted.
1074,czha9dj,t3_43bqa1,t1_czh898g,1454130155.0,brothulhu,6,0,0,0,6,Jack might actually have some sort of contractual interest here that would prevent him from getting involved. 
1075,czh8osa,t3_43bqa1,t1_czh898g,1454126634.0,QuitterQ,40,0,0,0,40,Jack was one of the leads of the Fine Bros' show MyMusic. He's too friendly with them to come after them.
1076,czh9nz0,t3_43bqa1,t1_czh8osa,1454128812.0,the_nice_nerd,1,0,0,0,1,"Crap! I forgot about MyMusic!
"
1077,czhd74n,t3_43bqa1,t1_czh8osa,1454138183.0,GroovingPict,4,0,0,0,4,"also been on several ""youtubers react to"" episodes"
1078,czhb5qy,t3_43bqa1,t1_czh8osa,1454132301.0,danarbok,6,0,0,0,6,That doesn't mean Jack can't tell right from wrong. 
1079,czheg30,t3_43bqa1,t1_czhb5qy,1454142745.0,PM_ME_FAVORITE_SONGS,5,0,0,0,5,"Yeah but if I were jack I'd just not talk about it with them.
It's hard to burn bridges, especially with them. "
1080,czh97zf,t3_43bqa1,t1_czh6ju9,1454127815.0,ownage99988,48,0,0,0,48,"LeafyIsHere might be good to mention too, he's kind of an asshole but he definitely does reaction videos. Also TotalBiscuit im sure would want to get in on this even though he may not be relevant, he loves to throw his power around."
1081,czhc36u,t3_43bqa1,t1_czh97zf,1454134803.0,NCRranger24,-5,0,0,0,-5,Hisssss
1082,czhdnit,t3_43bqa1,t1_czhc36u,1454139724.0,ownage99988,6,0,0,0,6,The saddest man on youtube
1083,czhdjw8,t3_43bqa1,t1_czh97zf,1454139378.0,IronicCatalyst,2,0,0,0,2,"Why is he an asshole? Serious question, Im a bit out of the loop here."
1084,czhdntz,t3_43bqa1,t1_czhdjw8,1454139754.0,ownage99988,-5,0,0,0,-5,"just watch his videos. he's kind of a bully, but it's absolutely hilarious"
1085,czhdu9r,t3_43bqa1,t1_czhdntz,1454140402.0,sporite,8,0,0,0,8,Not really. All he does is swear and say random shit while sometimes screaming. 
1086,czhdxbi,t3_43bqa1,t1_czhdu9r,1454140720.0,ninetalesz,2,0,0,0,2,"Might as well mention quite a few videos are half-assed and just taken from controversy in Youtube, reported the day previously by Drama Alert."
1087,czhe3xc,t3_43bqa1,t1_czhdu9r,1454141408.0,ownage99988,5,0,0,0,5,I mean that's also not wrong. Personally I find him hilarious
1088,czihwd0,t3_43bqa1,t1_czhdjw8,1454239917.0,jataba115,1,0,0,0,1,"Just from watching some of his videos (he's been pumping a lot of them out as of late, and gained about 500,000 subs) he reacts to a few clearly mentally ill people. Just recently one video centered around a very self-destructive and possibly bipolar guy who really needed some kind of counseling"
1089,czjqd3e,t3_43bqa1,t1_czh97zf,1454339045.0,stikas129,3,0,0,0,3,"TotalBiscuit probably won't, he said he is done with all social media outside of YouTube and Twitch because he has Cancer and could do without the extra stress."
1090,czhx4ot,t3_43bqa1,t1_czh97zf,1454189222.0,Lamenameman,3,0,0,0,3,"Love leafyishere. But his video about ""cyber bully"" is kinda cyber bullying. Yeah that girl's video sucked big time, but cmon. It was kinda dick move, other than that his great."
1091,czhx5bo,t3_43bqa1,t1_czhx4ot,1454189257.0,ownage99988,1,0,0,0,1,Yup exactly
1092,czhlnij,t3_43bqa1,t1_czh97zf,1454168178.0,xX_420_Blz_iT_Xx,5,0,0,0,5,"Pyrocynical, nfkrz and  officialduckstudios are also reaction people too. "
1093,czh2to1,t3_43bqa1,t3_43bqa1,1454114861.0,water_bottle_goggles,275,0,0,0,275,"Dude... you just used the word 'REACT' in your video.

Are you sure you can do that? 

Edit: /s"
1094,czh9azu,t3_43bqa1,t1_czh2to1,1454128006.0,DragonSlayerYomre,2,0,0,0,2,"Easy way around it:

[Audience] see ""The showcased products"" for the FIRST TIME!

Kids see ""Old 90's Handheld Games"" for the FIRST TIME!"
1095,czhagm3,t3_43bqa1,t1_czh9azu,1454130622.0,yParticle,0,0,0,0,0,â„¢
1096,czhfr1d,t3_43bqa1,t1_czh2to1,1454148246.0,LazyJones1,5,0,0,0,5,"The trademark is only valid in the context it is filed for.
McDonalds cannot drag scottish people to court for their names, but if they open a restaurant and use the name, McDonalds may have an argument, depending on the food type.

Similarly, the reaction videos would need to approach the format of ""an on-going series of programs and webisodes via the Internet in the field of observing and interviewing various groups of people.""

I very much doubt anyone will be in trouble for doing a video of their own reaction of something, even if the word react is in the title of the video."
1097,czh7x9m,t3_43bqa1,t1_czh2to1,1454124991.0,ithunk,78,0,0,0,78,"This is the kind of fear that this trademark brings. It doesnt even need to be enforced to stifle people. Just the fear is enough. This is wrong. They need to lose that trademark, just like Sony needs to never be allowed to trademark ""lets play"" and other such bullshit.


"
1098,czh9hrv,t3_43bqa1,t1_czh7x9m,1454128422.0,RisenLazarus,1,0,0,0,1,"Eh *this* isn't the actual kind of fear anyone's talking about.

And for what it's worth in case anyone's interested, Ryan can name his video as it is named because of Nominative Fair Use. Trademarks have to be talked about, and often using the actual name is the only way to do it."
1099,czhdpfh,t3_43bqa1,t1_czh7x9m,1454139916.0,NocturnalQuill,3,0,0,0,3,"I believe that Sony's application for ""let's play"" got rejected"
1100,czhapf1,t3_43bqa1,t1_czh7x9m,1454131194.0,Bluest_One,5,0,0,0,5,"It's why trademarks are not supposed to be allowed for purely descriptive words.

'X react to Y' is about as simple and descriptive as you can get. The Trademark office massively screwed up."
1101,czh8wv9,t3_43bqa1,t1_czh7x9m,1454127127.0,normalosmosis,38,0,0,0,38,My favorite video coming out of this whole fiasco is this http://youtu.be/CRYnOPJiTaA. Just wanted to share because it uses the word react in the title. Hi. 
1102,czihuwz,t3_43bqa1,t1_czh8wv9,1454239738.0,jataba115,1,0,0,0,1,404 Not Found. Is that intentional on your part?
1103,czhef2m,t3_43bqa1,t1_czh8wv9,1454142628.0,chasg,1,0,0,0,1,Hilarious (or ironic?): I get a 404 when I click your link (on my phone). Or am I whooshing? :-)
1104,czhv1kl,t3_43bqa1,t1_czh8wv9,1454185341.0,Oceandrive626,2,0,0,0,2,They just got one new subscriber. What a day to be alive
1105,czhbbe5,t3_43bqa1,t1_czh8wv9,1454132701.0,wileecoyote1969,2,0,0,0,2,that was awesome. thanks for sharing
1106,cziwzir,t3_43bqa1,t1_czh8wv9,1454273210.0,hoxem,3,0,0,0,3,Shoutout to money. That was hilarious.
1107,czh9ynp,t3_43bqa1,t1_czh8wv9,1454129488.0,IFARTONBABIES,5,0,0,0,5,Nice. Thanks for the link.
1108,czh2q2h,t3_43bqa1,t3_43bqa1,1454114677.0,TandoriBraetus,251,0,0,0,251,Been following your work since the Project M dev team disbanded and you are truly a godsend to game devs everywhere.  You are more than welcome to stop by /r/rivalsofaether and join our community too!
1109,czhdij7,t3_43bqa1,t1_czh2q2h,1454139246.0,Fatalfable,5,0,0,0,5,Rivlas of aether is such an awesome game. Purchased it a few months ago and it's such fun! 
1110,czhfo4q,t3_43bqa1,t1_czhdij7,1454147877.0,TandoriBraetus,1,0,0,0,1,Yo that's awesome!  I'm up to play some rounds with you sometime if you want!
1111,czh8429,t3_43bqa1,t3_43bqa1,1454125392.0,notduddeman,66,0,0,0,66,We should make a series of videos called 'fans react to bullshit' and it's all of us just making fun of the fine bros.
1112,czht0a8,t3_43bqa1,t1_czh8429,1454181647.0,Hammburglar,2,0,0,0,2,"We should do like game devs did with Candy Jam when King tried to trademark ""Candy"". Just inundate youtube with as many react videos as humanly possibly and tie up all their resources trying to stop them. "
1113,czht4wd,t3_43bqa1,t1_czht0a8,1454181869.0,notduddeman,3,0,0,0,3,I've got an idea. I'll steal the best /r/chemicalreactiongifs and get people to react to the reactions. 
1114,czh31aq,t3_43bqa1,t3_43bqa1,1454115256.0,CorsarioNero,187,0,0,0,187,"I was gonna suggest to get the EFF involved, like they did during the fight against patent trolls who tried to ~~copyright~~ patent podcasts. Would this help, /u/VideoGameAttorney? "
1115,czhe47h,t3_43bqa1,t1_czh31aq,1454141440.0,idlephase,6,0,0,0,6,> patent trolls who tried to **patent** podcasts
1116,czhibfb,t3_43bqa1,t1_czhe47h,1454159406.0,CorsarioNero,3,0,0,0,3,Fixed. 
1117,czhcf48,t3_43bqa1,t1_czh31aq,1454135748.0,yukichigai,20,0,0,0,20,Seconding this.  This entire situation seems right up the EFF's alley.
1118,czh6q38,t3_43bqa1,t3_43bqa1,1454122485.0,Sevsquad,22,0,0,0,22,"So Ideally who should we send this to? Jinx? Other ""react"" channels?"
1119,czhw4vv,t3_43bqa1,t1_czh6q38,1454187336.0,rambogini2,2,0,0,0,2,"Oh god, anyone *but* Jinx please."
1120,czhwijw,t3_43bqa1,t1_czhw4vv,1454188037.0,Sevsquad,3,0,0,0,3,I don't like it either but hey he's popular
1121,czhfygl,t3_43bqa1,t1_czh6q38,1454149207.0,Aron_b,6,0,0,0,6,Funny how some of reddit's most hated youtubers have the best standing here.
1122,czh5f06,t3_43bqa1,t3_43bqa1,1454119831.0,Patches67,363,0,0,0,363,"I think the real issue here is YouTube refuses to step the fuck up and protect its users, who YouTube often refers to in their own dialogue as 'partners'.  Pretty God damn shitty way to treat a partner.  "
1123,czhcyre,t3_43bqa1,t1_czh5f06,1454137435.0,marcm6246,-1,0,0,0,-1,Youtube wouldn't want to do that. The Fine Bros were one of the first [creators named to make exclusive content for Youtube Red.](http://ca.ign.com/articles/2015/10/21/pewdiepie-fine-brothers-series-help-launch-youtube-originals-slate). Youtube doesn't want to piss them off. At the end of the day it's about money. 
1124,czhmd5n,t3_43bqa1,t1_czh5f06,1454169616.0,marcuschookt,1,0,0,0,1,"Simple reason. There isn't a single video-streaming website out there that could hold a candle to what YouTube is capable of providing. It rules the market. And although every individual working at YouTube probably has morals, when a company gets that big it just doesn't work off ethics alone."
1125,czhhnn4,t3_43bqa1,t1_czh5f06,1454156871.0,Hendlton,1,0,0,0,1,"That's what I don't get. YouTube has a lot of reaction videos on it and they're making money from them so if they were to take them down, they'd lose money. Fine Bros can't exactly threaten to leave YouTube since there's nowhere to go so they must be giving YT some serious cash."
